processo,tipo_de_recurso,ministro_relator,orgao_julgador,data_do_julgamento,data_da_publicacao_fonte,tese_juridica,url_do_acordao,ementa,acordao
1935719,AIRESP,Ministro HERMAN BENJAMIN (1132),T2 - SEGUNDA TURMA,23/08/2021,DJe 31/08/2021,"PROCESSUAL CIVIL. AGRAVO INTERNO NO RECURSO ESPECIAL. CORREÇÃO MONETÁRIA E JUROS DE MORA. COISA JULGADA.1. No enfrentamento da matéria, o Tribunal de origem lançou os seguintes fundamentos: ""A decisão do TRF da 4ª Região, na Apelação Cível nº 2006.71.00.016488-0/RS, foi proferida em 15/06/2010 e manteve a sentença de primeiro grau, que condenou '...a União a pagar ao Banrisul o valor indicado na inicial (R$ 1.426.611,49), acrescido de correção monetária pelo IPCA-E a contar de maio de 2006 até o efetivo pagamento e juros moratórios de 1% ao mês a partir da citação.' (...) A norma em discussão, que previu a incidência da TR e juros pela caderneta de poupança não é posterior à decisão exequenda. Cabia à União ter questionado, no momento oportuno, os critérios de juros e correção monetária mantidos pelo Tribunal. Deve ser resguardada, assim, a coisa julgada.""2. Corroborando os referidos fundamentos, consta em Voto-Vista: ""Em que pese a sentença e o respectivo recurso de apelação sejam datados de 2007, o acórdão foi proferido pela Turma em 15/06/2010, após a entrada em vigor da Lei nº 11.960/09. Dessa forma, era possível à União invocar a modificação legislativa até a última oportunidade de alegação da objeção de defesa (ou arguição de temas novos e supervenientes) na instância ordinária (art. 474 do CPC), dado que não poderia inovar em recurso especial ou extraordinário, ante a necessidade do prequestionamento.""3. Consoante jurisprudência do STJ: i) não viola a coisa julgada pedido formulado na fase executiva que não pôde ser suscitado no processo de conhecimento, porquanto decorrente de fatos e normas supervenientes ""à última oportunidade de alegação da objeção de defesa na fase cognitiva, marco temporal que pode coincidir com a data da prolação da sentença, o exaurimento da instância ordinária ou mesmo o trânsito em julgado, conforme o caso"" (REsp 1.235.513/AL, Rel. Min. Castro Meira, Primeira Seção, DJe de 20.8.2012 - submetido ao regime dos Recursos Repetitivos); ii) é possível a revisão do capítulo dos consectários legais fixados no título judicial, em fase de liquidação ou cumprimento de sentença, em virtude da alteração operada pela lei nova (REsp 1.111.117/PR e REsp 1.111.119/PR, Rel. p/ Acórdão Ministro Mauro Campbell Marques, Corte Especial, DJe 2.9.2010 - jugado sob o Rito dos Recursos Repetitivos).4. No caso dos autos, contudo, a sentença objeto de execução foi proferida quando já em vigor os preceitos do Código Civil de 2002, sendo que a parte recorrente, embora tenha interposto recurso de Apelação, não se insurgiu quanto ao capítulo dos consectários fixados, cujo acórdão transitou em julgado em 2010, quando também em vigor os preceitos do art. 1º-F da Lei 9.494/1997, com a redação dada pela Lei 11.960/2009. Ou seja, o título judicial formou-se quando já em vigor o Código Civil de 2002 e a Lei 11.960/2009, o que inviabiliza a alteração do capítulo dos consectários fixados, sob pena de violação da coisa julgada.5. Com efeito, a Primeira Seção do STJ, no julgamento do REsp 1.495.146/MG - realizado sob a sistemática dos recursos repetitivos (Tema 905) -, pacificou o entendimento sobre a aplicação do art. 1º-F da Lei 9.494/1997 (com redação dada pela Lei 11.960/2009) às condenações impostas à Fazenda Pública. A ementa sintetizou o julgado com o seguinte teor: ""4. Preservação da coisa julgada. Não obstante os índices estabelecidos para atualização monetária e compensação da mora, de acordo com a natureza da condenação imposta à Fazenda Pública, cumpre ressalvar eventual coisa julgada que tenha determinado a aplicação de índices diversos, cuja constitucionalidade/legalidade há de ser aferida no caso concreto.""6. Dessume-se que o aresto hostilizado não diverge da orientação aludida.7. Agravo Interno não provido.",https://processo.stj.jus.br/SCON/GetInteiroTeorDoAcordao?num_registro=202101296393&dt_publicacao=31/08/2021,"PROCESSUAL CIVIL. AGRAVO INTERNO NO RECURSO ESPECIAL. CORREÇÃO MONETÁRIA E JUROS DE MORA. COISA JULGADA.1. No enfrentamento da matéria, o Tribunal de origem lançou os seguintes fundamentos: ""A decisão do TRF da 4ª Região, na Apelação Cível nº 2006.71.00.016488-0/RS, foi proferida em 15/06/2010 e manteve a sentença de primeiro grau, que condenou '...a União a pagar ao Banrisul o valor indicado na inicial (R$ 1.426.611,49), acrescido de correção monetária pelo IPCA-E a contar de maio de 2006 até o efetivo pagamento e juros moratórios de 1% ao mês a partir da citação.' (...) A norma em discussão, que previu a incidência da TR e juros pela caderneta de poupança não é posterior à decisão exequenda. Cabia à União ter questionado, no momento oportuno, os critérios de juros e correção monetária mantidos pelo Tribunal. Deve ser resguardada, assim, a coisa julgada.""2. Corroborando os referidos fundamentos, consta em Voto-Vista: ""Em que pese a sentença e o respectivo recurso de apelação sejam datados de 2007, o acórdão foi proferido pela Turma em 15/06/2010, após a entrada em vigor da Lei nº 11.960/09. Dessa forma, era possível à União invocar a modificação legislativa até a última oportunidade de alegação da objeção de defesa (ou arguição de temas novos e supervenientes) na instância ordinária (art. 474 do CPC), dado que não poderia inovar em recurso especial ou extraordinário, ante a necessidade do prequestionamento.""3. Consoante jurisprudência do STJ: i) não viola a coisa julgada pedido formulado na fase executiva que não pôde ser suscitado no processo de conhecimento, porquanto decorrente de fatos e normas supervenientes ""à última oportunidade de alegação da objeção de defesa na fase cognitiva, marco temporal que pode coincidir com a data da prolação da sentença, o exaurimento da instância ordinária ou mesmo o trânsito em julgado, conforme o caso"" (REsp 1.235.513/AL, Rel. Min. Castro Meira, Primeira Seção, DJe de 20.8.2012 - submetido ao regime dos Recursos Repetitivos); ii) é possível a revisão do capítulo dos consectários legais fixados no título judicial, em fase de liquidação ou cumprimento de sentença, em virtude da alteração operada pela lei nova (REsp 1.111.117/PR e REsp 1.111.119/PR, Rel. p/ Acórdão Ministro Mauro Campbell Marques, Corte Especial, DJe 2.9.2010 - jugado sob o Rito dos Recursos Repetitivos).4. No caso dos autos, contudo, a sentença objeto de execução foi proferida quando já em vigor os preceitos do Código Civil de 2002, sendo que a parte recorrente, embora tenha interposto recurso de Apelação, não se insurgiu quanto ao capítulo dos consectários fixados, cujo acórdão transitou em julgado em 2010, quando também em vigor os preceitos do art. 1º-F da Lei 9.494/1997, com a redação dada pela Lei 11.960/2009. Ou seja, o título judicial formou-se quando já em vigor o Código Civil de 2002 e a Lei 11.960/2009, o que inviabiliza a alteração do capítulo dos consectários fixados, sob pena de violação da coisa julgada.5. Com efeito, a Primeira Seção do STJ, no julgamento do REsp 1.495.146/MG - realizado sob a sistemática dos recursos repetitivos (Tema 905) -, pacificou o entendimento sobre a aplicação do art. 1º-F da Lei 9.494/1997 (com redação dada pela Lei 11.960/2009) às condenações impostas à Fazenda Pública. A ementa sintetizou o julgado com o seguinte teor: ""4. Preservação da coisa julgada. Não obstante os índices estabelecidos para atualização monetária e compensação da mora, de acordo com a natureza da condenação imposta à Fazenda Pública, cumpre ressalvar eventual coisa julgada que tenha determinado a aplicação de índices diversos, cuja constitucionalidade/legalidade há de ser aferida no caso concreto.""6. Dessume-se que o aresto hostilizado não diverge da orientação aludida.7. Agravo Interno não provido.","Vistos e relatados estes autos em que são partes as acima indicadas, acordam os Ministros da SEGUNDA TURMA do Superior Tribunal de Justiça, por unanimidade, negar provimento ao recurso, nos termos do voto do Sr. Ministro Relator.Os Srs. Ministros Francisco Falcão, Og Fernandes, Mauro Campbell Marques e Assusete Magalhães votaram com o Sr. Ministro Relator.Presidiu o julgamento o Sr. Ministro Herman Benjamin."
1928405,AIRESP,Ministro HERMAN BENJAMIN (1132),T2 - SEGUNDA TURMA,23/08/2021,DJe 31/08/2021,"PROCESSUAL CIVIL E ADMINISTRATIVO. AGRAVO INTERNO. EMBARGOS À EXECUÇÃO. ALEGAÇÃO DE INEXISTÊNCIA DE TÍTULO EXECUTIVO. REVOLVIMENTODE MATÉRIA FÁTICA. JUROS DE MORA. TERMO INICIAL. DIA DO VENCIMENTO DA OBRIGAÇÃO. CORREÇÃO MONETÁRIA IPCA-E.1. Trata-se de Agravo Interno interposto contra decisum que negou provimento ao Recurso Especial.2. Como se vê , a Corte a quo, no que tange à alegação da municipalidade de que os documentos não constituem título executivo extrajudicial por ausência de liquidez, concluiu, com base nos contratos e na nota de empenho juntada aos autos, que o título seria líquido e certo, uma vez que a licitação teria sido devidamente homologada e os contratos administrativos assinados. O órgão julgador decidiu a matéria após percuciente análise dos fatos e das provas relacionados à causa, sendo certo asseverar que o reexame é vedado em Recurso Especial, pois encontra óbice na Súmula 7/STJ. A propósito: AgInt no AREsp 1.563.073/SP, Rel. Ministro Ricardo Villas Bôas Cueva, Terceira Turma, DJe 29.10.2020.3. Em relação ao termo inicial dos juros de mora, o acórdão recorrido não merece reparos. A jurisprudência do STJ firmou entendimento de que, em se tratando de inadimplemento de obrigação contratual, positiva e líquida, o devedor estará em mora a partir do dia do vencimento da obrigação. Nesse norte: AgInt no AREsp 1.473.920/SP, Rel. Ministro Francisco Falcão, Segunda Turma, DJe 28.10.2019.4. Ademais, não merece acolhida a irresignação da impetrante quanto à aplicação dos índices de correção monetária. A jurisprudência do STJ possui orientação de que o art. 1º-F da Lei 9.494/1997 (com redação dada pela Lei 11.960/2009), para fins de correção monetária, não é aplicável nas condenações judiciais impostas à Fazenda Pública, independentemente de sua natureza, empregando-se, na espécie, o IPCA-E para as condenações administrativas em geral.Nesse sentido: REsp 1.495.146/MG, Rel. Ministro Mauro Campbell Marques, Primeira Seção, DJe 2.3.2018.5. Agravo Interno não provido.",https://processo.stj.jus.br/SCON/GetInteiroTeorDoAcordao?num_registro=202100820752&dt_publicacao=31/08/2021,"PROCESSUAL CIVIL E ADMINISTRATIVO. AGRAVO INTERNO. EMBARGOS À EXECUÇÃO. ALEGAÇÃO DE INEXISTÊNCIA DE TÍTULO EXECUTIVO. REVOLVIMENTODE MATÉRIA FÁTICA. JUROS DE MORA. TERMO INICIAL. DIA DO VENCIMENTO DA OBRIGAÇÃO. CORREÇÃO MONETÁRIA IPCA-E.1. Trata-se de Agravo Interno interposto contra decisum que negou provimento ao Recurso Especial.2. Como se vê , a Corte a quo, no que tange à alegação da municipalidade de que os documentos não constituem título executivo extrajudicial por ausência de liquidez, concluiu, com base nos contratos e na nota de empenho juntada aos autos, que o título seria líquido e certo, uma vez que a licitação teria sido devidamente homologada e os contratos administrativos assinados. O órgão julgador decidiu a matéria após percuciente análise dos fatos e das provas relacionados à causa, sendo certo asseverar que o reexame é vedado em Recurso Especial, pois encontra óbice na Súmula 7/STJ. A propósito: AgInt no AREsp 1.563.073/SP, Rel. Ministro Ricardo Villas Bôas Cueva, Terceira Turma, DJe 29.10.2020.3. Em relação ao termo inicial dos juros de mora, o acórdão recorrido não merece reparos. A jurisprudência do STJ firmou entendimento de que, em se tratando de inadimplemento de obrigação contratual, positiva e líquida, o devedor estará em mora a partir do dia do vencimento da obrigação. Nesse norte: AgInt no AREsp 1.473.920/SP, Rel. Ministro Francisco Falcão, Segunda Turma, DJe 28.10.2019.4. Ademais, não merece acolhida a irresignação da impetrante quanto à aplicação dos índices de correção monetária. A jurisprudência do STJ possui orientação de que o art. 1º-F da Lei 9.494/1997 (com redação dada pela Lei 11.960/2009), para fins de correção monetária, não é aplicável nas condenações judiciais impostas à Fazenda Pública, independentemente de sua natureza, empregando-se, na espécie, o IPCA-E para as condenações administrativas em geral.Nesse sentido: REsp 1.495.146/MG, Rel. Ministro Mauro Campbell Marques, Primeira Seção, DJe 2.3.2018.5. Agravo Interno não provido.","Vistos e relatados estes autos em que são partes as acima indicadas, acordam os Ministros da SEGUNDA TURMA do Superior Tribunal de Justiça, por unanimidade, negar provimento ao recurso, nos termos do voto do Sr. Ministro Relator.Os Srs. Ministros Francisco Falcão, Og Fernandes, Mauro Campbell Marques e Assusete Magalhães votaram com o Sr. Ministro Relator.Presidiu o julgamento o Sr. Ministro Herman Benjamin."
1487923,AIRESP,Ministro BENEDITO GONÇALVES (1142),T1 - PRIMEIRA TURMA,23/08/2021,DJe 25/08/2021,"PROCESSUAL CIVIL. AGRAVO INTERNO NO RECURSO ESPECIAL. VIOLAÇÃO DO ARTIGO 535 DO CPC/1973. AUSÊNCIA. SERVIDOR PÚBLICO. EXECUÇÃO DESENTENÇA CONTRA A FAZENDA PÚBLICA. JUROS DE MORA. ARTIGO 1º-F DA LEI Nº 9.494/97, COM A REDAÇÃO DADA PELA LEI Nº 11.960/2009. LEI DE REGÊNCIA. NATUREZA PROCESSUAL. APLICABILIDADE IMEDIATA AOS PROCESSOS EM ANDAMENTO. ALINHAMENTO À JURISPRUDÊNCIA DO STF E DO STJ.CAPITALIZAÇÃO. COMPENSAÇÃO DE PAGAMENTOS ADMINISTRATIVOS. JUROS DE MORA. IMPUTAÇÃO DO PAGAMENTO. ART. 354 DO CÓDIGO CIVIL. ALTERAÇÃO DO VOTO CONDUTOR. ÓBICE DA SÚMULA 7/STJ. PRECEDENTES. RECURSO NÃOPROVIDO.1. Caso em que o recorrente desde a origem se insurge contra decisão que, em sede execução de sentença, acolheu parcialmente a impugnação da União, determinando o cômputo de juros negativos sobre as parcelas pagas na via administrativa e homologando o critério de correção monetária dos valores devidos.2. Não há falar em violação do artigo 535 do CPC/1973, visto que o acórdão recorrido manifestou-se de maneira clara e fundamentada a respeito das questões relevantes para a solução da controvérsia. A tutela jurisdicional foi prestada de forma eficaz, não havendo razão para a anulação do acórdão proferido em sede de embargos de declaração.3. Acerca da alegada preclusão da compensação dos valores exequendos com os valores pagos na esfera administrativa, bem como apurar a impossibilidade de incidência de juros negativos nos pagamentos administrativos realizados, o recurso não merece conhecimento, pois, consoante jurisprudência desta Corte, a incursão nos referidos temas demandam necessariamente a revisão do contexto fático-probatório dos autos, circunstância que atrai a incidência da Súmula 7/STJ.Precedentes.4. No tocante à impossibilidade de alteração dos critérios fixados no título executado para fins de juros de mora e correção monetária, esta Corte firmou compreensão de que ""a lei nova superveniente que altera o regime dos juros moratórios deve ser aplicada imediatamente a todos os processos, abarcando inclusive aqueles em que já houve o trânsito em julgado e estejam em fase de execução, inexistindo ofensa à coisa julgada"" (AgInt no REsp 1.904.433/SC, Rel. Ministro Herman Benjamin, Segunda Turma, DJe 19/3/2021).5. Agravo interno não provido.",https://processo.stj.jus.br/SCON/GetInteiroTeorDoAcordao?num_registro=201402648925&dt_publicacao=25/08/2021,"PROCESSUAL CIVIL. AGRAVO INTERNO NO RECURSO ESPECIAL. VIOLAÇÃO DO ARTIGO 535 DO CPC/1973. AUSÊNCIA. SERVIDOR PÚBLICO. EXECUÇÃO DESENTENÇA CONTRA A FAZENDA PÚBLICA. JUROS DE MORA. ARTIGO 1º-F DA LEI Nº 9.494/97, COM A REDAÇÃO DADA PELA LEI Nº 11.960/2009. LEI DE REGÊNCIA. NATUREZA PROCESSUAL. APLICABILIDADE IMEDIATA AOS PROCESSOS EM ANDAMENTO. ALINHAMENTO À JURISPRUDÊNCIA DO STF E DO STJ.CAPITALIZAÇÃO. COMPENSAÇÃO DE PAGAMENTOS ADMINISTRATIVOS. JUROS DE MORA. IMPUTAÇÃO DO PAGAMENTO. ART. 354 DO CÓDIGO CIVIL. ALTERAÇÃO DO VOTO CONDUTOR. ÓBICE DA SÚMULA 7/STJ. PRECEDENTES. RECURSO NÃOPROVIDO.1. Caso em que o recorrente desde a origem se insurge contra decisão que, em sede execução de sentença, acolheu parcialmente a impugnação da União, determinando o cômputo de juros negativos sobre as parcelas pagas na via administrativa e homologando o critério de correção monetária dos valores devidos.2. Não há falar em violação do artigo 535 do CPC/1973, visto que o acórdão recorrido manifestou-se de maneira clara e fundamentada a respeito das questões relevantes para a solução da controvérsia. A tutela jurisdicional foi prestada de forma eficaz, não havendo razão para a anulação do acórdão proferido em sede de embargos de declaração.3. Acerca da alegada preclusão da compensação dos valores exequendos com os valores pagos na esfera administrativa, bem como apurar a impossibilidade de incidência de juros negativos nos pagamentos administrativos realizados, o recurso não merece conhecimento, pois, consoante jurisprudência desta Corte, a incursão nos referidos temas demandam necessariamente a revisão do contexto fático-probatório dos autos, circunstância que atrai a incidência da Súmula 7/STJ.Precedentes.4. No tocante à impossibilidade de alteração dos critérios fixados no título executado para fins de juros de mora e correção monetária, esta Corte firmou compreensão de que ""a lei nova superveniente que altera o regime dos juros moratórios deve ser aplicada imediatamente a todos os processos, abarcando inclusive aqueles em que já houve o trânsito em julgado e estejam em fase de execução, inexistindo ofensa à coisa julgada"" (AgInt no REsp 1.904.433/SC, Rel. Ministro Herman Benjamin, Segunda Turma, DJe 19/3/2021).5. Agravo interno não provido.","Vistos e relatados estes autos em que são partes as acima indicadas, acordam os Ministros da PRIMEIRA TURMA do Superior Tribunal de Justiça, por unanimidade, negar provimento ao recurso, nos termos do voto do Sr. Ministro Relator.Os Srs. Ministros Sérgio Kukina, Regina Helena Costa, Gurgel de Faria e Manoel Erhardt (Desembargador convocado do TRF-5ª Região) votaram com o Sr. Ministro Relator.Presidiu o julgamento o Sr. Ministro Benedito Gonçalves."
1896946,EDAIRESP,Ministro GURGEL DE FARIA (1160),T1 - PRIMEIRA TURMA,16/08/2021,DJe 20/08/2021,"PROCESSUAL CIVIL E PREVIDENCIÁRIO. EMBARGOS DE DECLARAÇÃO.REQUISITOS. OCORRÊNCIA. AÇÃO ACIDENTÁRIA. CORREÇÃO MONETÁRIA E JUROS. INPC E REMUNERAÇÃO OFICIAL DA CADERNETA DE POUPANÇA. APLICAÇÃO.1. Os embargos de declaração têm ensejo quando há obscuridade, contradição, omissão ou erro material no julgado.2. Hipótese em que a decisão impugnada no julgado embargado omitiu-se no exame de fundamentos relevantes expostos pela autarquia e manteve o acórdão do TJ/SP, baseando-se, equivocadamente, na repercussão geral do Supremo Tribunal Federal, que não tratou de benefício previdenciário, mas sim assistencial (RE 870.947/SE-RG).3. A Primeira Seção do STJ, no julgamento do Tema 905/STJ, firmou a compreensão de que, em se tratando de causas previdenciárias, as condenações impostas à Fazenda Pública, para efeito de correção monetária, sujeitam-se à incidência do INPC a partir da vigência do art. 41-A da Lei n. 8.213/1991, com a redação incluída pela Lei n. 11.430/2006.4. O INPC aplica-se na atualização monetária nas condenações de natureza previdenciária sem a limitação temporal dada pelo Tribunal de origem, ou seja, deve incidir inclusive no período posterior à entrada em vigor da Lei n. 11.960/2009, sendo certo que, para os períodos anteriores à entrada em vigor da Lei n. 11.430/2006, incidem os índices previstos no Manual de Cálculos da Justiça Federal.5. Quanto aos juros de mora, incidem segundo a remuneração oficial da caderneta de poupança (art. 1º-F da Lei n. 9.494/1997, com redação dada pela Lei n. 11.960/2009), independentemente de quais sejam os períodos a que se referirem os débitos de natureza previdenciária, conforme decisão no Tema 810/STF.6. In casu, a autarquia interpôs recurso especial em que postulou que a correção monetária observasse o INPC, a contar da Lei n. 10.741/2003, e a Taxa Referencial  TR, após a Lei n. 11.960/2009, circunstância que enseja o seu parcial acolhimento.7. Embargos de declaração acolhidos, com efeitos modificativos, para dar parcial provimento ao recurso especial.",https://processo.stj.jus.br/SCON/GetInteiroTeorDoAcordao?num_registro=202002485039&dt_publicacao=20/08/2021,"PROCESSUAL CIVIL E PREVIDENCIÁRIO. EMBARGOS DE DECLARAÇÃO.REQUISITOS. OCORRÊNCIA. AÇÃO ACIDENTÁRIA. CORREÇÃO MONETÁRIA E JUROS. INPC E REMUNERAÇÃO OFICIAL DA CADERNETA DE POUPANÇA. APLICAÇÃO.1. Os embargos de declaração têm ensejo quando há obscuridade, contradição, omissão ou erro material no julgado.2. Hipótese em que a decisão impugnada no julgado embargado omitiu-se no exame de fundamentos relevantes expostos pela autarquia e manteve o acórdão do TJ/SP, baseando-se, equivocadamente, na repercussão geral do Supremo Tribunal Federal, que não tratou de benefício previdenciário, mas sim assistencial (RE 870.947/SE-RG).3. A Primeira Seção do STJ, no julgamento do Tema 905/STJ, firmou a compreensão de que, em se tratando de causas previdenciárias, as condenações impostas à Fazenda Pública, para efeito de correção monetária, sujeitam-se à incidência do INPC a partir da vigência do art. 41-A da Lei n. 8.213/1991, com a redação incluída pela Lei n. 11.430/2006.4. O INPC aplica-se na atualização monetária nas condenações de natureza previdenciária sem a limitação temporal dada pelo Tribunal de origem, ou seja, deve incidir inclusive no período posterior à entrada em vigor da Lei n. 11.960/2009, sendo certo que, para os períodos anteriores à entrada em vigor da Lei n. 11.430/2006, incidem os índices previstos no Manual de Cálculos da Justiça Federal.5. Quanto aos juros de mora, incidem segundo a remuneração oficial da caderneta de poupança (art. 1º-F da Lei n. 9.494/1997, com redação dada pela Lei n. 11.960/2009), independentemente de quais sejam os períodos a que se referirem os débitos de natureza previdenciária, conforme decisão no Tema 810/STF.6. In casu, a autarquia interpôs recurso especial em que postulou que a correção monetária observasse o INPC, a contar da Lei n. 10.741/2003, e a Taxa Referencial  TR, após a Lei n. 11.960/2009, circunstância que enseja o seu parcial acolhimento.7. Embargos de declaração acolhidos, com efeitos modificativos, para dar parcial provimento ao recurso especial.","Vistos e relatados estes autos em que são partes as acima indicadas, acordam os Ministros da PRIMEIRA TURMA do Superior Tribunal de Justiça, por unanimidade, acolher os embargos de declaração, com efeitos modificativos, nos termos do voto do Sr. Ministro Relator.Os Srs. Ministros Benedito Gonçalves, Sérgio Kukina, Regina Helena Costa e Manoel Erhardt (Desembargador convocado do TRF-5ª Região) votaram com o Sr. Ministro Relator.Presidiu o julgamento o Sr. Ministro Benedito Gonçalves."
