processo,tipo_de_recurso,ministro_relator,orgao_julgador,data_do_julgamento,data_da_publicacao_fonte,tese_juridica,url_do_acordao,ementa,acordao
1912608,AIEDRESP,Ministro BENEDITO GONÇALVES (1142),T1 - PRIMEIRA TURMA,08/09/2021,DJe 10/09/2021,"PROCESSUAL CIVIL E ADMINISTRATIVO. AGRAVO INTERNO NOS EMBARGOS DE DECLARAÇÃO NO RECURSO ESPECIAL. SERVIDOR PÚBLICO. CONDENAÇÃO IMPOSTAÀ FAZENDA PÚBLICA. ARTIGO 1º-F DA LEI 9.494/1997, COM A REDAÇÃO DADA PELA LEI 11.960/2009. APLICAÇÃO IMEDIATA. RETROATIVIDADE VEDADA.JUROS MORATÓRIOS E CORREÇÃO MONETÁRIA. RESP 1.495.144/RS E RE 870.947/SE.1. O acórdão recorrido encontra-se em conformidade com a jurisprudência desta Corte, segundo a qual as alterações trazidas ao artigo 1º-F da Lei 9.494/1997 são aplicadas, de imediato, aos processos em andamento, sem efeitos retroativos (REsp 1.205.946/SP, Rel. Ministro Benedito Gonçalves, Corte Especial, DJe 2/2/2012).2. A Primeira Seção desta Corte, no julgamento do REsp 1.495.144/MG, representativo da controvérsia, observando a Repercussão Geral firmada pelo Supremo Tribunal Federal no RE 870.947/SE, consolidou o entendimento de que as condenações judiciais referentes a Servidores e Empregados Públicos sujeitam-se aos seguintes encargos: (a) até julho/2001: juros de mora: 1% ao mês (capitalização simples);correção monetária: índices previstos no Manual de Cálculos da Justiça Federal, com destaque para a incidência do IPCA-E a partir de janeiro/2001; (b) agosto/2001 a junho/2009: juros de mora: 0,5% ao mês; correção monetária: IPCAE; (c) a partir de julho/2009: juros de mora: remuneração oficial da caderneta de poupança; correção monetária: IPCA-E.3. Agravo interno não provido.",https://processo.stj.jus.br/SCON/GetInteiroTeorDoAcordao?num_registro=202003379008&dt_publicacao=10/09/2021,"PROCESSUAL CIVIL E ADMINISTRATIVO. AGRAVO INTERNO NOS EMBARGOS DE DECLARAÇÃO NO RECURSO ESPECIAL. SERVIDOR PÚBLICO. CONDENAÇÃO IMPOSTAÀ FAZENDA PÚBLICA. ARTIGO 1º-F DA LEI 9.494/1997, COM A REDAÇÃO DADA PELA LEI 11.960/2009. APLICAÇÃO IMEDIATA. RETROATIVIDADE VEDADA.JUROS MORATÓRIOS E CORREÇÃO MONETÁRIA. RESP 1.495.144/RS E RE 870.947/SE.1. O acórdão recorrido encontra-se em conformidade com a jurisprudência desta Corte, segundo a qual as alterações trazidas ao artigo 1º-F da Lei 9.494/1997 são aplicadas, de imediato, aos processos em andamento, sem efeitos retroativos (REsp 1.205.946/SP, Rel. Ministro Benedito Gonçalves, Corte Especial, DJe 2/2/2012).2. A Primeira Seção desta Corte, no julgamento do REsp 1.495.144/MG, representativo da controvérsia, observando a Repercussão Geral firmada pelo Supremo Tribunal Federal no RE 870.947/SE, consolidou o entendimento de que as condenações judiciais referentes a Servidores e Empregados Públicos sujeitam-se aos seguintes encargos: (a) até julho/2001: juros de mora: 1% ao mês (capitalização simples);correção monetária: índices previstos no Manual de Cálculos da Justiça Federal, com destaque para a incidência do IPCA-E a partir de janeiro/2001; (b) agosto/2001 a junho/2009: juros de mora: 0,5% ao mês; correção monetária: IPCAE; (c) a partir de julho/2009: juros de mora: remuneração oficial da caderneta de poupança; correção monetária: IPCA-E.3. Agravo interno não provido.","Vistos e relatados estes autos em que são partes as acima indicadas, acordam os Ministros da PRIMEIRA TURMA do Superior Tribunal de Justiça, por unanimidade, negar provimento ao recurso, nos termos do voto do Sr. Ministro Relator.Os Srs. Ministros Sérgio Kukina, Regina Helena Costa, Gurgel de Faria e Manoel Erhardt (Desembargador convocado do TRF-5ª Região) votaram com o Sr. Ministro Relator.Presidiu o julgamento o Sr. Ministro Benedito Gonçalves."
1774231,AINTARESP,Ministro FRANCISCO FALCÃO (1116),T2 - SEGUNDA TURMA,30/08/2021,DJe 02/09/2021,"PROCESSUAL CIVIL. SERVIDORES PÚBLICOS ESTADUAIS. ADICIONAIS POR TEMPO DE SERVIÇO. QUINQUÊNIOS SOBRE A INTEGRALIDADE DOS VENCIMENTOS. BASE DE CÁLCULO ABRANGENTE DO SALÁRIO-BASE, ACRESCIDO DE VANTAGENS PECUNIÁRIAS (VENCIMENTOS). DIVERGÊNCIA NÃO COMPROVADA. REVISÃO DO CRITÉRIO DE JUSTIÇA E EQUIDADE. VERBA ADVOCATÍCIA. VALOR ÍNFIMO OU EXORBITANTE. NÃO VERIFICADO. REEXAME DE FATOS E PROVAS. INCIDÊNCIADA SÚMULA N. 7 DO STJ. CORREÇÃO MONETÁRIA DAS CONDENAÇÕES IMPOSTAS À FAZENDA PÚBLICA. MATÉRIA DECIDIDA SOB O RITO DO ART. 1º-F DA LEI N. 9.494/1997 COM A REDAÇÃO DADA PELA LEI N. 11.960/2009. RE N.870.947/SE (TEMA N. 810/STF).I - Na origem, trata-se de ação ordinária, proposta por Antônio Canevari Filho e outros, servidores públicos inativos, contra a Fazenda do Estado de São Paulo e São Paulo Previdência - SPPrev, objetivando o recebimento do adicional por tempo de serviço, instituído pela Lei n. 10.261/1968. A sentença julgou improcedente o pedido. No Tribunal a quo, a sentença foi reformada.II - O dissídio jurisprudencial, viabilizador do recurso especial pela alínea c do permissivo constitucional, não foi demonstrado nos moldes legais, pois, além da ausência do cotejo analítico e de não ter apontado qual dispositivo legal recebeu tratamento diverso na jurisprudência pátria, não ficou evidenciada a similitude fática e jurídica entre os casos colacionados que teriam recebido interpretação divergente pela jurisprudência pátria.III - Para a caracterização da divergência, nos termos do art.1.029, § 1º, do CPC/2015 e do art. 255, §§ 1º e 2º, do RISTJ, exige-se, além da transcrição de acórdãos tidos por discordantes, a realização do cotejo analítico do dissídio jurisprudencial invocado, com a necessária demonstração de similitude fática entre o aresto impugnado e os acórdãos paradigmas, assim como a presença de soluções jurídicas diversas para a situação, sendo insuficiente, para tanto, a simples transcrição de ementas, como no caso. Nesse sentido: AgInt no AREsp n. 1.235.867/SP, relatora Ministra Assusete Magalhães, Segunda Turma, julgado em 17/5/2018, DJe 24/5/2018; AgInt no AREsp n. 1.109.608/SP, relator Ministro Og Fernandes, Segunda Turma, julgado em 13/3/2018, DJe 19/3/2018; REsp n. 1.717.512/AL, relator Ministro Herman Benjamin, Segunda Turma, julgado em 17/4/2018, DJe 23/5/2018.IV - No mais, no que tange à violação dos arts. 20, § 3º e 4º,CPC/1973, não é possível, por meio de recurso especial, a revisão do critério de justiça e equidade utilizado pelas instâncias ordinárias para fixação da verba advocatícia, por depender tal providência da reapreciação dos elementos fático-probatórios do caso concreto.V - Assim, excetuadas as hipóteses em que o valor afigura-se manifestamente ínfimo ou exorbitante, o que não se verifica na espécie, a majoração ou redução dos honorários advocatícios atrai a incidência da Súmula n. 7/STJ.VI - Por fim, quanto a apontada violação do artigo 1º-F da Lei n.9.494/1997, o recurso não comporta seguimento, vez que a decisão do Tribunal a quo, realizada em juízo de retratação, está em harmonia com o entendimento firmado com o entendimento do Supremo Tribunal Federal Federal, no julgamento do RE n. 870.947/SE, com repercussão geral reconhecida (Tema n. 810), a tese no sentido de ser inconstitucional a correção monetária das condenações impostas à Fazenda Pública segundo a remuneração oficial da caderneta de poupança.VII - Por sua vez, este egrégio Superior Tribunal de Justiça já assentou, em julgamento proferido pela Primeira Seção desta Corte (Resp n. 1.112.746/DF), que ""os juros de mora e a correção monetária são obrigações de trato sucessivo, que se renovam mês a mês, devendo, portanto, ser aplicada no mês de regência a legislação vigente"". (EDcl no AgRg no REsp n. 1.210.516/RS, relator Ministro Napoleão Nunes Maia Filho, Primeira Turma, julgado em 15/9/2015, DJe 25/9/2015). No mesmo sentido, o seguinte precedente: EDcl nos EDcl nos EDcl no AgRg no REsp n. 1.173.988/RS, relator Ministro Antonio Saldanha Palheiro, Sexta Turma, julgado em 4/12/2018, DJe 18/12/2018.VIII - Agravo interno improvido.",https://processo.stj.jus.br/SCON/GetInteiroTeorDoAcordao?num_registro=202002697666&dt_publicacao=02/09/2021,"PROCESSUAL CIVIL. SERVIDORES PÚBLICOS ESTADUAIS. ADICIONAIS POR TEMPO DE SERVIÇO. QUINQUÊNIOS SOBRE A INTEGRALIDADE DOS VENCIMENTOS. BASE DE CÁLCULO ABRANGENTE DO SALÁRIO-BASE, ACRESCIDO DE VANTAGENS PECUNIÁRIAS (VENCIMENTOS). DIVERGÊNCIA NÃO COMPROVADA. REVISÃO DO CRITÉRIO DE JUSTIÇA E EQUIDADE. VERBA ADVOCATÍCIA. VALOR ÍNFIMO OU EXORBITANTE. NÃO VERIFICADO. REEXAME DE FATOS E PROVAS. INCIDÊNCIADA SÚMULA N. 7 DO STJ. CORREÇÃO MONETÁRIA DAS CONDENAÇÕES IMPOSTAS À FAZENDA PÚBLICA. MATÉRIA DECIDIDA SOB O RITO DO ART. 1º-F DA LEI N. 9.494/1997 COM A REDAÇÃO DADA PELA LEI N. 11.960/2009. RE N.870.947/SE (TEMA N. 810/STF).I - Na origem, trata-se de ação ordinária, proposta por Antônio Canevari Filho e outros, servidores públicos inativos, contra a Fazenda do Estado de São Paulo e São Paulo Previdência - SPPrev, objetivando o recebimento do adicional por tempo de serviço, instituído pela Lei n. 10.261/1968. A sentença julgou improcedente o pedido. No Tribunal a quo, a sentença foi reformada.II - O dissídio jurisprudencial, viabilizador do recurso especial pela alínea c do permissivo constitucional, não foi demonstrado nos moldes legais, pois, além da ausência do cotejo analítico e de não ter apontado qual dispositivo legal recebeu tratamento diverso na jurisprudência pátria, não ficou evidenciada a similitude fática e jurídica entre os casos colacionados que teriam recebido interpretação divergente pela jurisprudência pátria.III - Para a caracterização da divergência, nos termos do art.1.029, § 1º, do CPC/2015 e do art. 255, §§ 1º e 2º, do RISTJ, exige-se, além da transcrição de acórdãos tidos por discordantes, a realização do cotejo analítico do dissídio jurisprudencial invocado, com a necessária demonstração de similitude fática entre o aresto impugnado e os acórdãos paradigmas, assim como a presença de soluções jurídicas diversas para a situação, sendo insuficiente, para tanto, a simples transcrição de ementas, como no caso. Nesse sentido: AgInt no AREsp n. 1.235.867/SP, relatora Ministra Assusete Magalhães, Segunda Turma, julgado em 17/5/2018, DJe 24/5/2018; AgInt no AREsp n. 1.109.608/SP, relator Ministro Og Fernandes, Segunda Turma, julgado em 13/3/2018, DJe 19/3/2018; REsp n. 1.717.512/AL, relator Ministro Herman Benjamin, Segunda Turma, julgado em 17/4/2018, DJe 23/5/2018.IV - No mais, no que tange à violação dos arts. 20, § 3º e 4º,CPC/1973, não é possível, por meio de recurso especial, a revisão do critério de justiça e equidade utilizado pelas instâncias ordinárias para fixação da verba advocatícia, por depender tal providência da reapreciação dos elementos fático-probatórios do caso concreto.V - Assim, excetuadas as hipóteses em que o valor afigura-se manifestamente ínfimo ou exorbitante, o que não se verifica na espécie, a majoração ou redução dos honorários advocatícios atrai a incidência da Súmula n. 7/STJ.VI - Por fim, quanto a apontada violação do artigo 1º-F da Lei n.9.494/1997, o recurso não comporta seguimento, vez que a decisão do Tribunal a quo, realizada em juízo de retratação, está em harmonia com o entendimento firmado com o entendimento do Supremo Tribunal Federal Federal, no julgamento do RE n. 870.947/SE, com repercussão geral reconhecida (Tema n. 810), a tese no sentido de ser inconstitucional a correção monetária das condenações impostas à Fazenda Pública segundo a remuneração oficial da caderneta de poupança.VII - Por sua vez, este egrégio Superior Tribunal de Justiça já assentou, em julgamento proferido pela Primeira Seção desta Corte (Resp n. 1.112.746/DF), que ""os juros de mora e a correção monetária são obrigações de trato sucessivo, que se renovam mês a mês, devendo, portanto, ser aplicada no mês de regência a legislação vigente"". (EDcl no AgRg no REsp n. 1.210.516/RS, relator Ministro Napoleão Nunes Maia Filho, Primeira Turma, julgado em 15/9/2015, DJe 25/9/2015). No mesmo sentido, o seguinte precedente: EDcl nos EDcl nos EDcl no AgRg no REsp n. 1.173.988/RS, relator Ministro Antonio Saldanha Palheiro, Sexta Turma, julgado em 4/12/2018, DJe 18/12/2018.VIII - Agravo interno improvido.","Vistos e relatados estes autos em que são partes as acima indicadas, acordam os Ministros da SEGUNDA TURMA do Superior Tribunal de Justiça, por unanimidade, negar provimento ao recurso, nos termos do voto do Sr. Ministro Relator.Os Srs. Ministros Herman Benjamin, Og Fernandes, Mauro Campbell Marques e Assusete Magalhães votaram com o Sr. Ministro Relator.Presidiu o julgamento o Sr. Ministro Herman Benjamin."
1925167,AIRESP,Ministro MAURO CAMPBELL MARQUES (1141),T2 - SEGUNDA TURMA,30/08/2021,DJe 02/09/2021,"ADMINISTRATIVO E PROCESSUAL CIVIL. ENUNCIADO ADMINISTRATIVO Nº 2/STJ. NEGATIVA DE PRESTAÇÃO JURISDICIONAL. SÚMULA Nº 284/STF. SUCUMBÊNCIA RECÍPROCA. SÚMULA Nº 7/STJ. PRESCRIÇÃO. INOCORRÊNCIA.SÚMULA Nº 83/STJ. JUROS DE MORA E CORREÇÃO MONETÁRIA. ART. 1º-F DA LEI Nº 9.494/1997. RE Nº 870947/SE. RESP Nº 1.492.221/PR.1. No que tange à alegada negativa de prestação, verifica-se que as razões de recorrer são genéricas, na medida em que limitam-se a afirmar que o acórdão a quo foi omisso e contraditório, sem contudo delimitar que a tese omitida é fundamental à conclusão do julgado e, se examinada, levaria à sua anulação ou reforma. Trata-se de deficiência na fundamentação, caso em que se aplica, por analogia, o disposto na Súmula 284/STF, in verbis: ""É inadmissível o recurso extraordinário, quando a deficiência na sua fundamentação não permitir a exata compreensão da controvérsia"".2. Nos termos da jurisprudência desta Corte Superior, é certo que, em casos de pagamento a menor de vantagem devida a servidor público (tal como o caso dos autos), não ocorre a prescrição do fundo do direito reclamado, mas apenas das parcelas vencidas no quinquênio que precedeu o ajuizamento da ação.3. Os juros de mora devem incidir da seguinte forma: (a) percentual de 1% ao mês (capitalização simples), nos termos do art. 3º Decreto nº 2.322/87, no período anterior à 24/08/2001, data de publicação da Medida Provisória nº 2.180-35, que acresceu o art. 1º-F à Lei nº 9.494/97; (b) percentual de 0,5% ao mês, a partir da MP nº 2.180-35/2001 até o advento da Lei n.º 11.960, de 30/06/2009, que deu nova redação ao art. 1º-F da Lei nº 9.494/97, e, após, (c) em correspondência com os juros aplicados à caderneta de poupança, consoante a regra do art. 1º-F da Lei 9.494/1997, com redação dada pela Lei nº 11.960/2009. Quanto à atualização monetária, afastada a incidência do art. 1º-F da Lei 9.494/1997, com redação dada pela Lei 11.960/2009, uma vez o índice ali definido ""não se qualifica como medida adequada a capturar a variação de preços da economia"".Incidente os índices previstos no Manual de Cálculos da Justiça Federal, com destaque para a incidência do IPCA-E a partir de janeiro/2001 (consoante julgado, pela Primeira Seção, em 22 de fevereiro de 2018, no REsp nº 1.492.221/PR, de minha relatoria, pelo rito dos recursos repetitivos).4. O conhecimento do tema relativo à sucumbência recíproca esbarra no óbice da Súmula nº 7/STJ - ""a pretensão de simples reexame de prova não enseja recurso especial"" -, uma vez que não se trata de discussão sobre o resultado jurídico da subsunção de normas federais, mas, sim, de revisão das premissas subjacentes.5. Agravo interno não provido.",https://processo.stj.jus.br/SCON/GetInteiroTeorDoAcordao?num_registro=202100618608&dt_publicacao=02/09/2021,"ADMINISTRATIVO E PROCESSUAL CIVIL. ENUNCIADO ADMINISTRATIVO Nº 2/STJ. NEGATIVA DE PRESTAÇÃO JURISDICIONAL. SÚMULA Nº 284/STF. SUCUMBÊNCIA RECÍPROCA. SÚMULA Nº 7/STJ. PRESCRIÇÃO. INOCORRÊNCIA.SÚMULA Nº 83/STJ. JUROS DE MORA E CORREÇÃO MONETÁRIA. ART. 1º-F DA LEI Nº 9.494/1997. RE Nº 870947/SE. RESP Nº 1.492.221/PR.1. No que tange à alegada negativa de prestação, verifica-se que as razões de recorrer são genéricas, na medida em que limitam-se a afirmar que o acórdão a quo foi omisso e contraditório, sem contudo delimitar que a tese omitida é fundamental à conclusão do julgado e, se examinada, levaria à sua anulação ou reforma. Trata-se de deficiência na fundamentação, caso em que se aplica, por analogia, o disposto na Súmula 284/STF, in verbis: ""É inadmissível o recurso extraordinário, quando a deficiência na sua fundamentação não permitir a exata compreensão da controvérsia"".2. Nos termos da jurisprudência desta Corte Superior, é certo que, em casos de pagamento a menor de vantagem devida a servidor público (tal como o caso dos autos), não ocorre a prescrição do fundo do direito reclamado, mas apenas das parcelas vencidas no quinquênio que precedeu o ajuizamento da ação.3. Os juros de mora devem incidir da seguinte forma: (a) percentual de 1% ao mês (capitalização simples), nos termos do art. 3º Decreto nº 2.322/87, no período anterior à 24/08/2001, data de publicação da Medida Provisória nº 2.180-35, que acresceu o art. 1º-F à Lei nº 9.494/97; (b) percentual de 0,5% ao mês, a partir da MP nº 2.180-35/2001 até o advento da Lei n.º 11.960, de 30/06/2009, que deu nova redação ao art. 1º-F da Lei nº 9.494/97, e, após, (c) em correspondência com os juros aplicados à caderneta de poupança, consoante a regra do art. 1º-F da Lei 9.494/1997, com redação dada pela Lei nº 11.960/2009. Quanto à atualização monetária, afastada a incidência do art. 1º-F da Lei 9.494/1997, com redação dada pela Lei 11.960/2009, uma vez o índice ali definido ""não se qualifica como medida adequada a capturar a variação de preços da economia"".Incidente os índices previstos no Manual de Cálculos da Justiça Federal, com destaque para a incidência do IPCA-E a partir de janeiro/2001 (consoante julgado, pela Primeira Seção, em 22 de fevereiro de 2018, no REsp nº 1.492.221/PR, de minha relatoria, pelo rito dos recursos repetitivos).4. O conhecimento do tema relativo à sucumbência recíproca esbarra no óbice da Súmula nº 7/STJ - ""a pretensão de simples reexame de prova não enseja recurso especial"" -, uma vez que não se trata de discussão sobre o resultado jurídico da subsunção de normas federais, mas, sim, de revisão das premissas subjacentes.5. Agravo interno não provido.","Vistos e relatados estes autos em que são partes as acima indicadas, acordam os Ministros da SEGUNDA TURMA do Superior Tribunal de Justiça, por unanimidade, negar provimento ao recurso, nos termos do voto do Sr. Ministro Relator.Os Srs. Ministros Francisco Falcão, Herman Benjamin, Og Fernandes e Assusete Magalhães votaram com o Sr. Ministro Relator.Presidiu o julgamento o Sr. Ministro Herman Benjamin."
1926868,AIRESP,Ministro HERMAN BENJAMIN (1132),T2 - SEGUNDA TURMA,09/08/2021,DJe 31/08/2021,"PROCESSUAL CIVIL E ADMINISTRATIVO. AGRAVO INTERNO. REPERCUSSÃO GERAL E RECURSOS REPETITIVOS. TESES FIRMADAS. ART. 1.030, II, CPC.CONDENAÇÃO CONTRA FAZENDA PÚBLICA. CORREÇÃO MONETÁRIA. JUROS DE MORA. ÍNDICES APLICÁVEIS. INCIDÊNCIA DAS SÚMULAS 280/STF E 7/STJ.1. Cuida-se de Agravo Interno contra decisum que conheceu parcialmente do Recurso Especial dos particulares, apenas em relação à preliminar de violação do art. 1.022 do CPC/2015, para, nessa parte, negar-lhe provimento, e não conheceu do Recurso Especial da Fazenda Pública.2. O fundamento central da controvérsia é de cunho eminentemente amparado em legislação local, a saber, Leis Distritais 4/1988, 38/1989 e 117/1990 e Decretos 12.728/1990 e 12.947/1990. Destaca-se a inviabilidade da discussão em Recurso Especial acerca de suposta afronta a matéria local, sendo defesa a sua apreciação pelo STJ.Aplicação, por analogia, da Súmula 280/STF, in verbis: ""Por ofensa a direito local não cabe Recurso Extraordinário."" Nesse sentido: AREsp 1.085.666/DF, Rel. Min. Og Fernandes, DJe 12.6.2017.Ademais, analisar a tese defendida nos dois Recursos Especiais de inobservância ao princípio da coisa julgada demanda novo exame do acervo fático-probatório constante dos autos, providência vedada em Recurso Especial, conforme o óbice previsto na Súmula 7/STJ.Confiram-se: AgInt no AREsp 715.774/DF, Rel. Min. Assusete Magalhães, Segunda Turma, DJe 22/8/2016; AgRg no REsp 738.198/DF, Rel. Min. Rogerio Schietti Cruz, Sexta Turma, DJe de 7.4.2015; EDcl nos EDcl no AgRg no AgRg no REsp 1.431.357/DF, Rel. Min. Humberto Martins, Segunda Turma, DJe de 15.9.2014; AgRg no AREsp 489.990/DF, Rel. Min. Humberto Martins, Segunda Turma, DJe de 2.6.2014; AgRg no AREsp 621.300/DF, Rel. Min. Mauro Campbell Marques, DJe 18.2.2015;AgRg no AgRg nos EDcl no AREsp. 4.111/SP, Rel. Min. Herman Benjamin, DJe 12.11.2014; AgRg no REsp 1.376.410/SP, Rel. Min. Sérgio Kukina, Primeira Turma, DJe 8.3.2016; AgInt no REsp 1.749.441/SP, Rel. Min. Herman Benjamin, Segunda Turma, DJe 11.3.2019) 3. Nessa conjuntura, verifica-se que o acórdão recorrido, após a retratação da instância de origem, está em consonância com a jurisprudência dos Tribunais Superiores a respeito do índice aplicável à correção monetária e aos juros de mora do débito em questão. A questão foi definida pelo STF ao julgar o Tema 810, em Repercussão Geral (RE 870.947, Relator(a): Min. Luiz Fux, Tribunal Pleno, julgado em 20.9.2017, Acórdão eletrônico repercussão geral - mérito DJe-262 Divulg 17.11.2017 public 20.11.2017). Por sua vez, o STJ possui o entendimento fixado no Tema 905, submetido à Sistemática dos Recursos Especiais Repetitivos (REsp 1.495.146/MG, Rel. Min. Mauro Campbell Marques, Primeira Seção, DJe 2.3.2018).4. Agravo Interno não provido.",https://processo.stj.jus.br/SCON/GetInteiroTeorDoAcordao?num_registro=202100725001&dt_publicacao=31/08/2021,"PROCESSUAL CIVIL E ADMINISTRATIVO. AGRAVO INTERNO. REPERCUSSÃO GERAL E RECURSOS REPETITIVOS. TESES FIRMADAS. ART. 1.030, II, CPC.CONDENAÇÃO CONTRA FAZENDA PÚBLICA. CORREÇÃO MONETÁRIA. JUROS DE MORA. ÍNDICES APLICÁVEIS. INCIDÊNCIA DAS SÚMULAS 280/STF E 7/STJ.1. Cuida-se de Agravo Interno contra decisum que conheceu parcialmente do Recurso Especial dos particulares, apenas em relação à preliminar de violação do art. 1.022 do CPC/2015, para, nessa parte, negar-lhe provimento, e não conheceu do Recurso Especial da Fazenda Pública.2. O fundamento central da controvérsia é de cunho eminentemente amparado em legislação local, a saber, Leis Distritais 4/1988, 38/1989 e 117/1990 e Decretos 12.728/1990 e 12.947/1990. Destaca-se a inviabilidade da discussão em Recurso Especial acerca de suposta afronta a matéria local, sendo defesa a sua apreciação pelo STJ.Aplicação, por analogia, da Súmula 280/STF, in verbis: ""Por ofensa a direito local não cabe Recurso Extraordinário."" Nesse sentido: AREsp 1.085.666/DF, Rel. Min. Og Fernandes, DJe 12.6.2017.Ademais, analisar a tese defendida nos dois Recursos Especiais de inobservância ao princípio da coisa julgada demanda novo exame do acervo fático-probatório constante dos autos, providência vedada em Recurso Especial, conforme o óbice previsto na Súmula 7/STJ.Confiram-se: AgInt no AREsp 715.774/DF, Rel. Min. Assusete Magalhães, Segunda Turma, DJe 22/8/2016; AgRg no REsp 738.198/DF, Rel. Min. Rogerio Schietti Cruz, Sexta Turma, DJe de 7.4.2015; EDcl nos EDcl no AgRg no AgRg no REsp 1.431.357/DF, Rel. Min. Humberto Martins, Segunda Turma, DJe de 15.9.2014; AgRg no AREsp 489.990/DF, Rel. Min. Humberto Martins, Segunda Turma, DJe de 2.6.2014; AgRg no AREsp 621.300/DF, Rel. Min. Mauro Campbell Marques, DJe 18.2.2015;AgRg no AgRg nos EDcl no AREsp. 4.111/SP, Rel. Min. Herman Benjamin, DJe 12.11.2014; AgRg no REsp 1.376.410/SP, Rel. Min. Sérgio Kukina, Primeira Turma, DJe 8.3.2016; AgInt no REsp 1.749.441/SP, Rel. Min. Herman Benjamin, Segunda Turma, DJe 11.3.2019) 3. Nessa conjuntura, verifica-se que o acórdão recorrido, após a retratação da instância de origem, está em consonância com a jurisprudência dos Tribunais Superiores a respeito do índice aplicável à correção monetária e aos juros de mora do débito em questão. A questão foi definida pelo STF ao julgar o Tema 810, em Repercussão Geral (RE 870.947, Relator(a): Min. Luiz Fux, Tribunal Pleno, julgado em 20.9.2017, Acórdão eletrônico repercussão geral - mérito DJe-262 Divulg 17.11.2017 public 20.11.2017). Por sua vez, o STJ possui o entendimento fixado no Tema 905, submetido à Sistemática dos Recursos Especiais Repetitivos (REsp 1.495.146/MG, Rel. Min. Mauro Campbell Marques, Primeira Seção, DJe 2.3.2018).4. Agravo Interno não provido.","Vistos e relatados estes autos em que são partes as acima indicadas, acordam os Ministros da SEGUNDA TURMA do Superior Tribunal de Justiça, por unanimidade, negar provimento ao recurso, nos termos do voto do Sr. Ministro Relator.Os Srs. Ministros Francisco Falcão, Og Fernandes, Mauro Campbell Marques e Assusete Magalhães votaram com o Sr. Ministro Relator.Presidiu o julgamento o Sr. Ministro Herman Benjamin."
