processo,tipo_de_recurso,ministro_relator,orgao_julgador,data_do_julgamento,data_da_publicacao_fonte,tese_juridica,url_do_acordao,ementa,acordao
1897239,RESP,Ministro HERMAN BENJAMIN (1132),T2 - SEGUNDA TURMA,01/12/2020,DJe 18/12/2020,"PROCESSUAL CIVIL E ADMINISTRATIVO. RECURSO ESPECIAL. DISCUSSÃO SOBRE A APLICAÇÃO DO ART. 1º-F DA LEI 9.494/1997, COM REDAÇÃO DADA PELALEI 11.960/2009, ÀS CONDENAÇÕES IMPOSTAS À FAZENDA PÚBLICA. DECISÃO DO STF NOS EMBARGOS DE DECLARAÇÃO NO RE 870.947/SE. MODULAÇÃO REJEITADA. QUESTÕES DECIDIDAS PELA TESE FIRMADA NO TEMA 905/STJ.1. Não se configura a ofensa ao art. 535 do Código de Processo Civil/1973, uma vez que o Tribunal de origem julgou integralmente a lide e solucionou a controvérsia, em conformidade com o que lhe foi apresentado. Ademais, não assiste melhor sorte ao recorrente, no que tange à arguição de ofensa ao art. 458 do Código de Processo Civil/1973, tendo em vista que o aresto impugnado se encontra devidamente fundamentado, tratando todos os pontos necessários à resolução do feito.2. O Supremo Tribunal Federal examinou as questões advindas da aplicação de juros e correção monetária sobre os débitos da Fazenda Pública ? em decorrência da vigência do art. 1º-F da Lei 9.494/1997, introduzido pela MP 2.180-35/2001, e da posterior alteração pela Lei 11.960/2009 ? representadas pelos Temas 435 e 810/STF.3. Com efeito, na sessão do dia 3/10/2019, o Plenário do STF concluiu o julgamento do RE 870.947/SE, submetido ao rito da Repercussão Geral (Tema 810/STF), em que, por maioria, rejeitou todos os Embargos de Declaração interpostos e não modulou os efeitos da decisão anteriormente proferida no leading case.4. Observando a decisão do STF, a Primeira Seção do STJ, nos termos do Tema 905/STJ (Recursos Especiais 1.495.146/MG, 1.492.221/PR e 1.495.144/RS, Rel. Ministro Mauro Campbell Marques), determinou que as condenações impostas à Fazenda Pública de natureza previdenciária sujeitam-se à incidência do INPC, para fins de correção monetária, no que se refere ao período posterior à vigência da Lei 11.430/2006, que incluiu o art. 41-A na Lei 8.213/91. Quanto aos juros de mora, recaem segundo a remuneração oficial da caderneta de poupança (art.1º-F da Lei 9.494/97, com redação dada pela Lei 11.960/2009).5. No enfrentamento da matéria, o Tribunal de origem lançou os seguintes fundamentos: ""Os juros moratórios, incidentes a partir da citação (24.09.2013 fls. 110), conforme Súmula 204 do S.T.J., serão calculados sobre as parcelas em atraso englobadamente até a citação, e, depois, mês a mês, de forma decrescente de acordo com os índices determinados pelo art. 1º-F da Lei nº 9.494/97, redação dada pela Lei nº 11.960/09, razão pela qual dá se provimento ao apelo do obreiro. Não se aplica a T.R. como índice de correção monetária (conforme julgamento da ADIn 4425 pelo pleno do S.T.F., em 14.03.2013, DJe-251 18.12.2013, ressalvado o que vier a ser decidido em sua modulação de efeitos), devendo aplicar-se o IGP-DI (Lei nº 8.213/91) até a conta de liquidação e, a partir de então, o IPCA-E, conforme consagrada jurisprudência destas Câmaras Especializadas"".6. Dessume-se que o acórdão recorrido não está em sintonia com o atual entendimento do STJ, razão pela qual merece prosperar parcialmente a irresignação.7. Na hipótese, por se tratar de condenação judicial de natureza previdenciária, incide o INPC, para fins de correção monetária, no que se refere ao período posterior à vigência da Lei 11.430/2006, que incluiu o artigo 41-A na Lei 8.213/1991. No período anterior à vigência da Lei 11.430/2006, devem ser aplicados os índices previstos no Manual de Cálculos da Justiça Federal.8. No tocante aos juros de mora, incidem segundo a remuneração oficial da caderneta de poupança, consoante artigo 1º-F da Lei 9.494/1997, com redação dada pela Lei 11.960/2009.9. Recurso Especial parcialmente conhecido e, nessa extensão, parcialmente provido.",https://processo.stj.jus.br/SCON/GetInteiroTeorDoAcordao?num_registro=202002505049&dt_publicacao=18/12/2020,"PROCESSUAL CIVIL E ADMINISTRATIVO. RECURSO ESPECIAL. DISCUSSÃO SOBRE A APLICAÇÃO DO ART. 1º-F DA LEI 9.494/1997, COM REDAÇÃO DADA PELALEI 11.960/2009, ÀS CONDENAÇÕES IMPOSTAS À FAZENDA PÚBLICA. DECISÃO DO STF NOS EMBARGOS DE DECLARAÇÃO NO RE 870.947/SE. MODULAÇÃO REJEITADA. QUESTÕES DECIDIDAS PELA TESE FIRMADA NO TEMA 905/STJ.1. Não se configura a ofensa ao art. 535 do Código de Processo Civil/1973, uma vez que o Tribunal de origem julgou integralmente a lide e solucionou a controvérsia, em conformidade com o que lhe foi apresentado. Ademais, não assiste melhor sorte ao recorrente, no que tange à arguição de ofensa ao art. 458 do Código de Processo Civil/1973, tendo em vista que o aresto impugnado se encontra devidamente fundamentado, tratando todos os pontos necessários à resolução do feito.2. O Supremo Tribunal Federal examinou as questões advindas da aplicação de juros e correção monetária sobre os débitos da Fazenda Pública ? em decorrência da vigência do art. 1º-F da Lei 9.494/1997, introduzido pela MP 2.180-35/2001, e da posterior alteração pela Lei 11.960/2009 ? representadas pelos Temas 435 e 810/STF.3. Com efeito, na sessão do dia 3/10/2019, o Plenário do STF concluiu o julgamento do RE 870.947/SE, submetido ao rito da Repercussão Geral (Tema 810/STF), em que, por maioria, rejeitou todos os Embargos de Declaração interpostos e não modulou os efeitos da decisão anteriormente proferida no leading case.4. Observando a decisão do STF, a Primeira Seção do STJ, nos termos do Tema 905/STJ (Recursos Especiais 1.495.146/MG, 1.492.221/PR e 1.495.144/RS, Rel. Ministro Mauro Campbell Marques), determinou que as condenações impostas à Fazenda Pública de natureza previdenciária sujeitam-se à incidência do INPC, para fins de correção monetária, no que se refere ao período posterior à vigência da Lei 11.430/2006, que incluiu o art. 41-A na Lei 8.213/91. Quanto aos juros de mora, recaem segundo a remuneração oficial da caderneta de poupança (art.1º-F da Lei 9.494/97, com redação dada pela Lei 11.960/2009).5. No enfrentamento da matéria, o Tribunal de origem lançou os seguintes fundamentos: ""Os juros moratórios, incidentes a partir da citação (24.09.2013 fls. 110), conforme Súmula 204 do S.T.J., serão calculados sobre as parcelas em atraso englobadamente até a citação, e, depois, mês a mês, de forma decrescente de acordo com os índices determinados pelo art. 1º-F da Lei nº 9.494/97, redação dada pela Lei nº 11.960/09, razão pela qual dá se provimento ao apelo do obreiro. Não se aplica a T.R. como índice de correção monetária (conforme julgamento da ADIn 4425 pelo pleno do S.T.F., em 14.03.2013, DJe-251 18.12.2013, ressalvado o que vier a ser decidido em sua modulação de efeitos), devendo aplicar-se o IGP-DI (Lei nº 8.213/91) até a conta de liquidação e, a partir de então, o IPCA-E, conforme consagrada jurisprudência destas Câmaras Especializadas"".6. Dessume-se que o acórdão recorrido não está em sintonia com o atual entendimento do STJ, razão pela qual merece prosperar parcialmente a irresignação.7. Na hipótese, por se tratar de condenação judicial de natureza previdenciária, incide o INPC, para fins de correção monetária, no que se refere ao período posterior à vigência da Lei 11.430/2006, que incluiu o artigo 41-A na Lei 8.213/1991. No período anterior à vigência da Lei 11.430/2006, devem ser aplicados os índices previstos no Manual de Cálculos da Justiça Federal.8. No tocante aos juros de mora, incidem segundo a remuneração oficial da caderneta de poupança, consoante artigo 1º-F da Lei 9.494/1997, com redação dada pela Lei 11.960/2009.9. Recurso Especial parcialmente conhecido e, nessa extensão, parcialmente provido.","Vistos, relatados e discutidos os autos em que são partes as acima indicadas, acordam os Ministros da Segunda Turma do Superior Tribunal de Justiça: """"A Turma, por unanimidade, conheceu em parte do recurso e, nessa parte, deu-lhe parcial provimento, nos termos do voto do(a) Sr(a). Ministro(a)-Relator(a)."" Os Srs. Ministros Og Fernandes, Mauro Campbell Marques, Assusete Magalhães e Francisco Falcão votaram com o Sr. Ministro Relator."""
1898814,RESP,Ministro HERMAN BENJAMIN (1132),T2 - SEGUNDA TURMA,24/11/2020,DJe 18/12/2020,"ADMINISTRATIVO E PROCESSUAL CIVIL. FALTA PARCIAL DEPREQUESTIONAMENTO. SÚMULA 211/STJ. CONDENAÇÃO. FAZENDA PÚBLICA. DÉBITO DE NATUREZA NÃO TRIBUTÁRIA.1. A indicada afronta ao art. 240 do CPC não pode ser analisada, pois o Tribunal de origem não emitiu juízo de valor sobre esse dispositivo legal. O Superior Tribunal de Justiça entende ser inviável o conhecimento do Recurso Especial quando os artigos tidos por violados não foram apreciados pelo Tribunal a quo, a despeito da oposição de Embargos de Declaração, haja vista a ausência do requisito do prequestionamento. Incide, na espécie, a Súmula 211/STJ.2. O STF, ao julgar a ADI 4.357/DF e a ADI 4.425/DF, assim como o RE 870.947/SE, em regime de repercussão geral, considerou constitucional a incidência de juros de mora com base no índice oficial de remuneração da caderneta de poupança, nas condenações impostas à Fazenda Pública, excepcionados os débitos de natureza tributária.3. Nesse contexto, afastou-se a aplicação do art. 1º-F da Lei 9.497/1997, com a redação dada pela Lei 11.960/2009, para fins de correção monetária sobre débito de qualquer natureza, mantida sua incidência no que concerne à fixação dos juros de mora, salvo em relação a débitos oriundos de relação jurídico-tributária. Diante da orientação do STF, a Primeira Seção do Superior Tribunal de Justiça realinhou seu posicionamento quanto ao tema aqui controvertido, no julgamento do REsp 1.495.144/RS - apreciado juntamente com os REsps 1.492.221/PR e 1.495.146/MG -, todos sob o regime de recursos repetitivos.4. Portanto, as condenações judiciais referentes a servidores e empregados públicos sujeitam-se aos seguintes encargos: a) até julho/2001: juros de mora: 1% ao mês (capitalização simples);correção monetária: índices previstos no Manual de Cálculos da Justiça Federal, com destaque para a incidência do IPCA-E a partir de janeiro/2001; b) agosto/2001 a junho/2009: juros de mora: 0,5% ao mês; correção monetária: IPCA-E; c) a partir de julho/2009: juros de mora: remuneração oficial da caderneta de poupança; correção monetária: IPCA-E.5. Recurso Especial conhecido em parte e, nessa parte, não provido.",https://processo.stj.jus.br/SCON/GetInteiroTeorDoAcordao?num_registro=202002591700&dt_publicacao=18/12/2020,"ADMINISTRATIVO E PROCESSUAL CIVIL. FALTA PARCIAL DEPREQUESTIONAMENTO. SÚMULA 211/STJ. CONDENAÇÃO. FAZENDA PÚBLICA. DÉBITO DE NATUREZA NÃO TRIBUTÁRIA.1. A indicada afronta ao art. 240 do CPC não pode ser analisada, pois o Tribunal de origem não emitiu juízo de valor sobre esse dispositivo legal. O Superior Tribunal de Justiça entende ser inviável o conhecimento do Recurso Especial quando os artigos tidos por violados não foram apreciados pelo Tribunal a quo, a despeito da oposição de Embargos de Declaração, haja vista a ausência do requisito do prequestionamento. Incide, na espécie, a Súmula 211/STJ.2. O STF, ao julgar a ADI 4.357/DF e a ADI 4.425/DF, assim como o RE 870.947/SE, em regime de repercussão geral, considerou constitucional a incidência de juros de mora com base no índice oficial de remuneração da caderneta de poupança, nas condenações impostas à Fazenda Pública, excepcionados os débitos de natureza tributária.3. Nesse contexto, afastou-se a aplicação do art. 1º-F da Lei 9.497/1997, com a redação dada pela Lei 11.960/2009, para fins de correção monetária sobre débito de qualquer natureza, mantida sua incidência no que concerne à fixação dos juros de mora, salvo em relação a débitos oriundos de relação jurídico-tributária. Diante da orientação do STF, a Primeira Seção do Superior Tribunal de Justiça realinhou seu posicionamento quanto ao tema aqui controvertido, no julgamento do REsp 1.495.144/RS - apreciado juntamente com os REsps 1.492.221/PR e 1.495.146/MG -, todos sob o regime de recursos repetitivos.4. Portanto, as condenações judiciais referentes a servidores e empregados públicos sujeitam-se aos seguintes encargos: a) até julho/2001: juros de mora: 1% ao mês (capitalização simples);correção monetária: índices previstos no Manual de Cálculos da Justiça Federal, com destaque para a incidência do IPCA-E a partir de janeiro/2001; b) agosto/2001 a junho/2009: juros de mora: 0,5% ao mês; correção monetária: IPCA-E; c) a partir de julho/2009: juros de mora: remuneração oficial da caderneta de poupança; correção monetária: IPCA-E.5. Recurso Especial conhecido em parte e, nessa parte, não provido.","Vistos, relatados e discutidos os autos em que são partes as acima indicadas, acordam os Ministros da Segunda Turma do Superior Tribunal de Justiça: """"A Turma, por unanimidade, conheceu em parte do recurso e, nessa parte, negou-lhe provimento, nos termos do voto do(a) Sr(a). Ministro(a)-Relator(a)."" Os Srs. Ministros Og Fernandes, Mauro Campbell Marques, Assusete Magalhães e Francisco Falcão votaram com o Sr. Ministro Relator."""
1900559,RESP,Ministro HERMAN BENJAMIN (1132),T2 - SEGUNDA TURMA,24/11/2020,DJe 18/12/2020,"PROCESSUAL CIVIL E PREVIDENCIÁRIO. RECURSO ESPECIAL. VIOLAÇÃO DO ART. 535 DO CPC/1973 NÃO CONFIGURADA. AUXÍLIO-ACIDENTE E APOSENTADORIA. ACUMULAÇÃO DE BENEFÍCIOS. AUXÍLIO-ACIDENTE CONCEDIDO ANTES DA VIGÊNCIA DA LEI 9.528/1997, E APOSENTADORIA CONCEDIDA APÓS A SUA VIGÊNCIA. IMPOSSIBILIDADE. DISCUSSÃO SOBRE A APLICAÇÃO DO ART. 1º-F DA LEI 9.494/1997, COM REDAÇÃO DADA PELA LEI 11.960/2009, ÀSCONDENAÇÕES IMPOSTAS À FAZENDA PÚBLICA. DECISÃO DO STF NOS EMBARGOS DE DECLARAÇÃO NO RE 870.947/SE. MODULAÇÃO REJEITADA. QUESTÕES DECIDIDAS PELA TESE FIRMADA NO TEMA 905/STJ.1. Não se configura a ofensa ao art. 535 do Código de Processo Civil/1973, uma vez que o Tribunal de origem julgou integralmente a lide e solucionou a controvérsia, em conformidade com o que lhe foi apresentado.2. Ressalte-se que a mera insatisfação com o conteúdo da decisão embargada não enseja Embargos de Declaração. Esse não é o objetivo dos aclaratórios, recurso que se presta tão somente a sanar contradições ou omissões decorrentes da ausência de análise dos temas trazidos à tutela jurisdicional, no momento processual oportuno, conforme o art. 535 do CPC/1973.3. A Primeira Seção do STJ, no julgamento do Tema 555, vinculado ao Recurso Especial Repetitivo 1.296.673/MG, consolidou o entendimento de que ""a acumulação do auxílio-acidente com proventos de aposentadoria pressupõe que a eclosão da lesão incapacitante, apta a gerar o direito ao auxílio-acidente, e a concessão da aposentadoria sejam anteriores à alteração do art. 86, §§ 2º e 3º, da Lei 8.213/1991, promovida em 11.11.1997 pela Medida Provisória 1.596-14/1997, posteriormente convertida na Lei 9.528/1997"".4. Na hipótese dos autos, o acórdão combatido consignou: ""Trata-se de ação em que pretende o autor o restabelecimento de auxílio-acidente que teve termo inicial em 01/09/1993 (fls. 30), cessado em virtude da concessão de aposentadoria por idade em 07/04/2014 (fls. 35). No caso em tela, inexiste ilegalidade na cumulação desses benefícios. Com efeito, concedido o auxílio-acidente a partir de 01/09/1993 (fls. 30), portanto antes da vigência da Lei n° 9.528/97, faz o obreiro jus a seu recebimento em caráter vitalício, como lhe assegurava à época o § 1º do art. 86 da Lei nº 8.213/91 (em sua redação original), cuidando-se de direito adquirido, imutável por força do princípio 'tempus regit actum'.Assim, os efeitos da nova regra não podem retroagir para alcançar situação anteriormente consolidada e por ela não abrangida. (...)Dentro desse quadro, não havendo obstáculo para a cumulação do benefício de auxílio-acidente com a aposentadoria por idade, é de ser provido o recurso para determinar o restabelecimento do auxílio-acidente a partir da cessação (fls. 30)"".5. Dessa forma, por estar em dissonância do entendimento do STJ, deve ser reformado o aresto proferido na origem com a adoção do entendimento consolidado pelo recurso repetitivo supra.6. O Supremo Tribunal Federal examinou as questões advindas da aplicação de juros e da correção monetária sobre os débitos da Fazenda Pública ? em decorrência da vigência do art. 1º-F da Lei 9.494/1997, introduzido pela MP 2.180-35/2001, e da posterior alteração pela Lei 11.960/2009 ? , representadas pelos Temas 435 e 810/STF.7. Com efeito, na sessão do dia 3/10/2019, o Plenário do STF concluiu o julgamento do RE 870.947/SE, submetido ao rito da Repercussão Geral (Tema 810/STF), em que, por maioria, rejeitou todos os Embargos de Declaração interpostos e não modulou os efeitos da decisão anteriormente proferida no leading case.8. Observando a decisão do STF, a Primeira Seção do STJ, nos termos do Tema 905/STJ (Recursos Especiais 1.495.146/MG, 1.492.221/PR e 1.495.144/RS, Rel. Ministro Mauro Campbell Marques), determinou que as condenações impostas à Fazenda Pública de natureza previdenciária sujeitam-se à incidência do INPC, para fins de correção monetária, no que se refere ao período posterior à vigência da Lei 11.430/2006, que incluiu o art. 41-A na Lei 8.213/91. Quanto aos juros de mora, incidem segundo a remuneração oficial da caderneta de poupança (art.1º-F da Lei 9.494/97, com redação dada pela Lei 11.960/2009).9. No enfrentamento da matéria, o Tribunal de origem lançou os seguintes fundamentos: ""No mais, cabe deixar explicitado que o débito será atualizado pelos índices de correção pertinentes (no caso pelo IGP-DI), seguindo-se a forma estabelecida pelo art. 41 da Lei nº 8.213/91. Outrossim, consoante orientação jurisprudencial do Superior Tribunal de Justiça, consolidada em sede de recurso especial repetitivo, a atualização do crédito a partir da elaboração da conta de liquidação deve ser feita pelo IPCA-E (REsp 1.102.484/SP, 3ª Seção, rel. Min. Arnaldo Esteves Lima, j. em 22/04/2009, DJe de 20/05/2009)"".10. Dessume-se que o acórdão recorrido não está em sintonia com o atual entendimento do STJ, razão pela qual merece prosperar parcialmente a irresignação.11. Na hipótese, por se tratar de condenação judicial de natureza previdenciária, incide o INPC, para fins de correção monetária, no que se refere ao período posterior à vigência da Lei 11.430/2006, que incluiu o artigo 41-A na Lei 8.213/1991. No período anterior à vigência da Lei 11.430/2006, devem ser aplicados os índices previstos no Manual de Cálculos da Justiça Federal.12. No tocante aos juros de mora, recaem segundo a remuneração oficial da caderneta de poupança, consoante artigo 1º-F da Lei 9.494/1997, com redação dada pela Lei 11.960/2009.13. Recurso Especial parcialmente conhecido, apenas em relação à preliminar de violação do art. 535 do CPC/1973, e, nessa parte, parcialmente provido.",https://processo.stj.jus.br/SCON/GetInteiroTeorDoAcordao?num_registro=202002670486&dt_publicacao=18/12/2020,"PROCESSUAL CIVIL E PREVIDENCIÁRIO. RECURSO ESPECIAL. VIOLAÇÃO DO ART. 535 DO CPC/1973 NÃO CONFIGURADA. AUXÍLIO-ACIDENTE E APOSENTADORIA. ACUMULAÇÃO DE BENEFÍCIOS. AUXÍLIO-ACIDENTE CONCEDIDO ANTES DA VIGÊNCIA DA LEI 9.528/1997, E APOSENTADORIA CONCEDIDA APÓS A SUA VIGÊNCIA. IMPOSSIBILIDADE. DISCUSSÃO SOBRE A APLICAÇÃO DO ART. 1º-F DA LEI 9.494/1997, COM REDAÇÃO DADA PELA LEI 11.960/2009, ÀSCONDENAÇÕES IMPOSTAS À FAZENDA PÚBLICA. DECISÃO DO STF NOS EMBARGOS DE DECLARAÇÃO NO RE 870.947/SE. MODULAÇÃO REJEITADA. QUESTÕES DECIDIDAS PELA TESE FIRMADA NO TEMA 905/STJ.1. Não se configura a ofensa ao art. 535 do Código de Processo Civil/1973, uma vez que o Tribunal de origem julgou integralmente a lide e solucionou a controvérsia, em conformidade com o que lhe foi apresentado.2. Ressalte-se que a mera insatisfação com o conteúdo da decisão embargada não enseja Embargos de Declaração. Esse não é o objetivo dos aclaratórios, recurso que se presta tão somente a sanar contradições ou omissões decorrentes da ausência de análise dos temas trazidos à tutela jurisdicional, no momento processual oportuno, conforme o art. 535 do CPC/1973.3. A Primeira Seção do STJ, no julgamento do Tema 555, vinculado ao Recurso Especial Repetitivo 1.296.673/MG, consolidou o entendimento de que ""a acumulação do auxílio-acidente com proventos de aposentadoria pressupõe que a eclosão da lesão incapacitante, apta a gerar o direito ao auxílio-acidente, e a concessão da aposentadoria sejam anteriores à alteração do art. 86, §§ 2º e 3º, da Lei 8.213/1991, promovida em 11.11.1997 pela Medida Provisória 1.596-14/1997, posteriormente convertida na Lei 9.528/1997"".4. Na hipótese dos autos, o acórdão combatido consignou: ""Trata-se de ação em que pretende o autor o restabelecimento de auxílio-acidente que teve termo inicial em 01/09/1993 (fls. 30), cessado em virtude da concessão de aposentadoria por idade em 07/04/2014 (fls. 35). No caso em tela, inexiste ilegalidade na cumulação desses benefícios. Com efeito, concedido o auxílio-acidente a partir de 01/09/1993 (fls. 30), portanto antes da vigência da Lei n° 9.528/97, faz o obreiro jus a seu recebimento em caráter vitalício, como lhe assegurava à época o § 1º do art. 86 da Lei nº 8.213/91 (em sua redação original), cuidando-se de direito adquirido, imutável por força do princípio 'tempus regit actum'.Assim, os efeitos da nova regra não podem retroagir para alcançar situação anteriormente consolidada e por ela não abrangida. (...)Dentro desse quadro, não havendo obstáculo para a cumulação do benefício de auxílio-acidente com a aposentadoria por idade, é de ser provido o recurso para determinar o restabelecimento do auxílio-acidente a partir da cessação (fls. 30)"".5. Dessa forma, por estar em dissonância do entendimento do STJ, deve ser reformado o aresto proferido na origem com a adoção do entendimento consolidado pelo recurso repetitivo supra.6. O Supremo Tribunal Federal examinou as questões advindas da aplicação de juros e da correção monetária sobre os débitos da Fazenda Pública ? em decorrência da vigência do art. 1º-F da Lei 9.494/1997, introduzido pela MP 2.180-35/2001, e da posterior alteração pela Lei 11.960/2009 ? , representadas pelos Temas 435 e 810/STF.7. Com efeito, na sessão do dia 3/10/2019, o Plenário do STF concluiu o julgamento do RE 870.947/SE, submetido ao rito da Repercussão Geral (Tema 810/STF), em que, por maioria, rejeitou todos os Embargos de Declaração interpostos e não modulou os efeitos da decisão anteriormente proferida no leading case.8. Observando a decisão do STF, a Primeira Seção do STJ, nos termos do Tema 905/STJ (Recursos Especiais 1.495.146/MG, 1.492.221/PR e 1.495.144/RS, Rel. Ministro Mauro Campbell Marques), determinou que as condenações impostas à Fazenda Pública de natureza previdenciária sujeitam-se à incidência do INPC, para fins de correção monetária, no que se refere ao período posterior à vigência da Lei 11.430/2006, que incluiu o art. 41-A na Lei 8.213/91. Quanto aos juros de mora, incidem segundo a remuneração oficial da caderneta de poupança (art.1º-F da Lei 9.494/97, com redação dada pela Lei 11.960/2009).9. No enfrentamento da matéria, o Tribunal de origem lançou os seguintes fundamentos: ""No mais, cabe deixar explicitado que o débito será atualizado pelos índices de correção pertinentes (no caso pelo IGP-DI), seguindo-se a forma estabelecida pelo art. 41 da Lei nº 8.213/91. Outrossim, consoante orientação jurisprudencial do Superior Tribunal de Justiça, consolidada em sede de recurso especial repetitivo, a atualização do crédito a partir da elaboração da conta de liquidação deve ser feita pelo IPCA-E (REsp 1.102.484/SP, 3ª Seção, rel. Min. Arnaldo Esteves Lima, j. em 22/04/2009, DJe de 20/05/2009)"".10. Dessume-se que o acórdão recorrido não está em sintonia com o atual entendimento do STJ, razão pela qual merece prosperar parcialmente a irresignação.11. Na hipótese, por se tratar de condenação judicial de natureza previdenciária, incide o INPC, para fins de correção monetária, no que se refere ao período posterior à vigência da Lei 11.430/2006, que incluiu o artigo 41-A na Lei 8.213/1991. No período anterior à vigência da Lei 11.430/2006, devem ser aplicados os índices previstos no Manual de Cálculos da Justiça Federal.12. No tocante aos juros de mora, recaem segundo a remuneração oficial da caderneta de poupança, consoante artigo 1º-F da Lei 9.494/1997, com redação dada pela Lei 11.960/2009.13. Recurso Especial parcialmente conhecido, apenas em relação à preliminar de violação do art. 535 do CPC/1973, e, nessa parte, parcialmente provido.","Vistos, relatados e discutidos os autos em que são partes as acima indicadas, acordam os Ministros da Segunda Turma do Superior Tribunal de Justiça: """"A Turma, por unanimidade, conheceu em parte do recurso e, nessa parte, deu-lhe parcial provimento, nos termos do voto do(a) Sr(a). Ministro(a)-Relator(a)."" Os Srs. Ministros Og Fernandes, Mauro Campbell Marques, Assusete Magalhães e Francisco Falcão votaram com o Sr. Ministro Relator."""
