processo,tipo_de_recurso,ministro_relator,orgao_julgador,data_do_julgamento,data_da_publicacao_fonte,tese_juridica,url_do_acordao,ementa,acordao
1834549,AINTARESP,Ministro FRANCISCO FALCÃO (1116),T2 - SEGUNDA TURMA,11/10/2021,DJe 14/10/2021,"PROCESSUAL CIVIL. ADMINISTRATIVO. SERVIDOR. APOSENTADORIA. REVISÃO. ART. 1º DO DECRETO N. 20.910/1932. MÉDICO. ATIVIDADE INSALUBRE. DECRETO N. 53.831/1964. TEMPO DE SERVIÇO. CONTAGEM PONDERADA. DIFERENÇAS. ALEGADA VIOLAÇÃO DO ART. 1022 DO CPC/2015. NÃO VERIFICADA. PARIDADE ENTRE ATIVOS E INATIVOS. PRESCRIÇÃO DE TRATOSUCESSIVO. JUROS DE MORA E CORREÇÃO MONETÁRIA. PRECEDENTES.I - Na origem, trata-se de ação objetivando a contagem de tempo de serviço, a revisão de aposentadoria e o recebimento de parcelas vencidas. A sentença julgou parcialmente procedente o pedido. O Tribunal a quo, a sentença foi parcialmente reformada.II - Não há violação do art. 535 do CPC/1973 (art. 1.022 do CPC/2015) quando o Tribunal a quo se manifesta clara e fundamentadamente acerca dos pontos indispensáveis para o desate da controvérsia, apreciando-a fundamentadamente (art. 165 do CPC/1973 e art. 489 do CPC/2015), apontando as razões de seu convencimento, ainda que de forma contrária aos interesses da parte, como verificado na hipótese.III - Quanto à prescrição, é importante destacar que a jurisprudência desta Corte Superior é firme no sentido de que não se opera a prescrição de fundo de direito nos casos em que se objetivem a revisão dos proventos de aposentadoria, com base na paridade entre ativos e inativos, nos termos do art. 40, § 8º, da Constituição da República. Nesse sentido: AgInt no AREsp n. 1.488.269/RS, relator Ministro Mauro Campbell Marques, Segunda Turma, julgado em 27/8/2019, DJe 30/8/2019 e AgInt no AREsp n. 1.421.772/RS, relator Ministro Og Fernandes, Segunda Turma, julgado em 6/6/2019, DJe 12/6/2019.IV - Quanto à apontada violação do art. 1º-F da Lei n. 9.494/1997, o recurso não comporta seguimento, vez que a decisão do Tribunal a quo está em harmonia com o entendimento firmado com o entendimento do Supremo Tribunal Federal, no julgamento do RE n. 870.947/SE, com repercussão geral reconhecida (Tema n. 810), a tese no sentido de ser inconstitucional a correção monetária das condenações impostas à Fazenda Pública, segundo a remuneração oficial da caderneta de poupança.V - Por sua vez, o Superior Tribunal de Justiça já assentou, em julgamento proferido pela Primeira Seção dessa Corte (Resp n. 1.112.746/DF), que ""os juros de mora e a correção monetária são obrigações de trato sucessivo, que se renovam mês a mês, devendo, portanto, ser aplicada no mês de regência a legislação vigente"".(EDcl no AgRg no REsp n. 1.210.516/RS, relator Ministro Napoleão Nunes Maia Filho, Primeira Turma, julgado em 15/9/2015, DJe 25/9/2015).VI - Por fim, verifica-se que agravo interno não se reveste de notória evidência, a justificar a cristalização de conduta abusiva/protelatória, em virtude da mera interposição do recurso, sendo inaplicável a penalidade do art. 1.021, § 4º, do CPC.VII - Agravo interno improvido.",https://processo.stj.jus.br/SCON/GetInteiroTeorDoAcordao?num_registro=202100471930&dt_publicacao=14/10/2021,"PROCESSUAL CIVIL. ADMINISTRATIVO. SERVIDOR. APOSENTADORIA. REVISÃO. ART. 1º DO DECRETO N. 20.910/1932. MÉDICO. ATIVIDADE INSALUBRE. DECRETO N. 53.831/1964. TEMPO DE SERVIÇO. CONTAGEM PONDERADA. DIFERENÇAS. ALEGADA VIOLAÇÃO DO ART. 1022 DO CPC/2015. NÃO VERIFICADA. PARIDADE ENTRE ATIVOS E INATIVOS. PRESCRIÇÃO DE TRATOSUCESSIVO. JUROS DE MORA E CORREÇÃO MONETÁRIA. PRECEDENTES.I - Na origem, trata-se de ação objetivando a contagem de tempo de serviço, a revisão de aposentadoria e o recebimento de parcelas vencidas. A sentença julgou parcialmente procedente o pedido. O Tribunal a quo, a sentença foi parcialmente reformada.II - Não há violação do art. 535 do CPC/1973 (art. 1.022 do CPC/2015) quando o Tribunal a quo se manifesta clara e fundamentadamente acerca dos pontos indispensáveis para o desate da controvérsia, apreciando-a fundamentadamente (art. 165 do CPC/1973 e art. 489 do CPC/2015), apontando as razões de seu convencimento, ainda que de forma contrária aos interesses da parte, como verificado na hipótese.III - Quanto à prescrição, é importante destacar que a jurisprudência desta Corte Superior é firme no sentido de que não se opera a prescrição de fundo de direito nos casos em que se objetivem a revisão dos proventos de aposentadoria, com base na paridade entre ativos e inativos, nos termos do art. 40, § 8º, da Constituição da República. Nesse sentido: AgInt no AREsp n. 1.488.269/RS, relator Ministro Mauro Campbell Marques, Segunda Turma, julgado em 27/8/2019, DJe 30/8/2019 e AgInt no AREsp n. 1.421.772/RS, relator Ministro Og Fernandes, Segunda Turma, julgado em 6/6/2019, DJe 12/6/2019.IV - Quanto à apontada violação do art. 1º-F da Lei n. 9.494/1997, o recurso não comporta seguimento, vez que a decisão do Tribunal a quo está em harmonia com o entendimento firmado com o entendimento do Supremo Tribunal Federal, no julgamento do RE n. 870.947/SE, com repercussão geral reconhecida (Tema n. 810), a tese no sentido de ser inconstitucional a correção monetária das condenações impostas à Fazenda Pública, segundo a remuneração oficial da caderneta de poupança.V - Por sua vez, o Superior Tribunal de Justiça já assentou, em julgamento proferido pela Primeira Seção dessa Corte (Resp n. 1.112.746/DF), que ""os juros de mora e a correção monetária são obrigações de trato sucessivo, que se renovam mês a mês, devendo, portanto, ser aplicada no mês de regência a legislação vigente"".(EDcl no AgRg no REsp n. 1.210.516/RS, relator Ministro Napoleão Nunes Maia Filho, Primeira Turma, julgado em 15/9/2015, DJe 25/9/2015).VI - Por fim, verifica-se que agravo interno não se reveste de notória evidência, a justificar a cristalização de conduta abusiva/protelatória, em virtude da mera interposição do recurso, sendo inaplicável a penalidade do art. 1.021, § 4º, do CPC.VII - Agravo interno improvido.","Vistos e relatados estes autos em que são partes as acima indicadas, acordam os Ministros da SEGUNDA TURMA do Superior Tribunal de Justiça, por unanimidade, negar provimento ao recurso, nos termos do voto do Sr. Ministro Relator.Os Srs. Ministros Herman Benjamin, Og Fernandes, Mauro Campbell Marques e Assusete Magalhães votaram com o Sr. Ministro Relator.Presidiu o julgamento o Sr. Ministro Herman Benjamin."
1931692,AIRESP,Ministro HERMAN BENJAMIN (1132),T2 - SEGUNDA TURMA,20/09/2021,DJe 13/10/2021,"TRIBUTÁRIO E PROCESSUAL CIVIL. AGRAVO INTERNO. CONDENAÇÃO IMPOSTA ÀFAZENDA PÚBLICA. RESTITUIÇÃO DE INDÉBITO TRIBUTÁRIO. CONTRIBUIÇÃO PREVIDENCIÁRIA DESTINADA AO REGIME PRÓPRIO DE PREVIDÊNCIA DOSSERVIDORES ESTADUAIS. CORREÇÃO MONETÁRIA E JUROS DE MORA. INAPLICABILIDADE DO ART. 1º-F DA LEI 9.494/1997. PRECEDENTES DO STJ.1. Conforme sintetizou o Tribunal bandeirante, verbis, ""cuida-se de cumprimento de sentença oriundo de ação ordinária julgada procedente a fim de que sejam restituídos os valores descontados dos proventos dos autores, servidores públicos inativos, a título de contribuição previdenciária, ao IPESP, desde a vigência da EC20/1998 até a data da promulgação da EC 41/2003, acrescidos de correção monetária pela Tabela deste Tribunal, a partir de cada recolhimento indevido, e de juros de mora de 1% ao mês, desde a citação"" (fls. 406, e-STJ).2. ""Ao contrário do que alega o recorrente, a relação jurídica de direito material posta em questão tem inegável naturezatributária. O simples fato de a contribuição previdenciária destinar-se ao regime próprio de previdência estadual não transmuta a natureza da condenação, que tem origem na cobrança indevida de tributo estadual.Precedente: AgInt no REsp 1894935/PR, Rel. Ministra ASSUSETE MAGALHÃES, SEGUNDA TURMA, julgado em 22/03/2021, DJe 26/03/2021. No mais, em relação à aplicação do art. 1º-F da Lei 9.494/1997, consoante entendimento da Primeira Seção desta Corte, firmada sob a sistemática dos recursos repetitivos, 'em se tratando de dívida de natureza tributária, não é possível a incidência do art. 1º-F da Lei 9.494/97 (com redação dada pela Lei 11.960/2009) - nem para atualização monetária nem para compensação da mora' (REsp 1.495.146/MG, Rel. Ministro Mauro Campbell Marques, Primeira Seção, DJe de 2/3/2018)"". (AgInt no REsp 1.912.911/PR, Rel. Ministro Herman Benjamin, Segunda Turma, DJe 3.8.2021, grifou-se).3. Agravo Interno provido para dar parcial provimento ao Recurso Especial e determinar a incidência de juros moratórios e correção monetária nos termos da fundamentação.",https://processo.stj.jus.br/SCON/GetInteiroTeorDoAcordao?num_registro=202101011139&dt_publicacao=13/10/2021,"TRIBUTÁRIO E PROCESSUAL CIVIL. AGRAVO INTERNO. CONDENAÇÃO IMPOSTA ÀFAZENDA PÚBLICA. RESTITUIÇÃO DE INDÉBITO TRIBUTÁRIO. CONTRIBUIÇÃO PREVIDENCIÁRIA DESTINADA AO REGIME PRÓPRIO DE PREVIDÊNCIA DOSSERVIDORES ESTADUAIS. CORREÇÃO MONETÁRIA E JUROS DE MORA. INAPLICABILIDADE DO ART. 1º-F DA LEI 9.494/1997. PRECEDENTES DO STJ.1. Conforme sintetizou o Tribunal bandeirante, verbis, ""cuida-se de cumprimento de sentença oriundo de ação ordinária julgada procedente a fim de que sejam restituídos os valores descontados dos proventos dos autores, servidores públicos inativos, a título de contribuição previdenciária, ao IPESP, desde a vigência da EC20/1998 até a data da promulgação da EC 41/2003, acrescidos de correção monetária pela Tabela deste Tribunal, a partir de cada recolhimento indevido, e de juros de mora de 1% ao mês, desde a citação"" (fls. 406, e-STJ).2. ""Ao contrário do que alega o recorrente, a relação jurídica de direito material posta em questão tem inegável naturezatributária. O simples fato de a contribuição previdenciária destinar-se ao regime próprio de previdência estadual não transmuta a natureza da condenação, que tem origem na cobrança indevida de tributo estadual.Precedente: AgInt no REsp 1894935/PR, Rel. Ministra ASSUSETE MAGALHÃES, SEGUNDA TURMA, julgado em 22/03/2021, DJe 26/03/2021. No mais, em relação à aplicação do art. 1º-F da Lei 9.494/1997, consoante entendimento da Primeira Seção desta Corte, firmada sob a sistemática dos recursos repetitivos, 'em se tratando de dívida de natureza tributária, não é possível a incidência do art. 1º-F da Lei 9.494/97 (com redação dada pela Lei 11.960/2009) - nem para atualização monetária nem para compensação da mora' (REsp 1.495.146/MG, Rel. Ministro Mauro Campbell Marques, Primeira Seção, DJe de 2/3/2018)"". (AgInt no REsp 1.912.911/PR, Rel. Ministro Herman Benjamin, Segunda Turma, DJe 3.8.2021, grifou-se).3. Agravo Interno provido para dar parcial provimento ao Recurso Especial e determinar a incidência de juros moratórios e correção monetária nos termos da fundamentação.","Vistos e relatados estes autos em que são partes as acima indicadas, acordam os Ministros da SEGUNDA TURMA do Superior Tribunal de Justiça, por unanimidade, dar provimento ao recurso, nos termos do voto do Sr. Ministro Relator.Os Srs. Ministros Francisco Falcão, Og Fernandes, Mauro Campbell Marques e Assusete Magalhães votaram com o Sr. Ministro Relator.Presidiu o julgamento o Sr. Ministro Herman Benjamin."
1736751,AINTARESP,Ministro FRANCISCO FALCÃO (1116),T2 - SEGUNDA TURMA,04/10/2021,DJe 07/10/2021,"PROCESSUAL CIVIL. ADMINISTRATIVO. LICITAÇÃO. CONTRATO. FORNECIMENTO DE PAINEL ELETRÔNICO PARA O MUNICÍPIO. VALOR CONTRATADO. EMBARGOS ÀEXECUÇÃO. IMPROCEDENCIA. JUROS MORATÓRIOS. CORREÇÃO MONETÁRIA. HONORÁRIOS ADVOCATÍCIOS RECURSAIS. ART 85, § 11 DO CPC/2015.I - Na origem, trata-se de embargos opostos pelo Município do Guarujá à execução ajuizada por Bruna Painéis Eletrônicos Ltda. objetivando a cobrança de valores pelo fornecimento de painel eletrônico para o estádio municipal. Na sentença, julgaram-se improcedentes os pedidos dos embargos. No Tribunal a quo, a sentença foi reformada para indeferir a petição inicial, por falta de interesse. Nesta Corte, conheceu-se do agravo para dar provimento ao recurso especial.II - A jurisprudência do Superior Tribunal de Justiça é firme no sentido de que os índices de correção monetária e de juros moratórios, foram definidos no julgamento do RE n. 870.947/SE, vinculado ao Tema 810/STF da repercussão geral, pelo plenário da Corte Suprema não tendo sido modulado os efeitos da decisão, mas tendo sido tão somente lhe dado eficácia prospectiva à declaração de inconstitucionalidade do índice previsto no artigo 1º-F da Lei n. 9.494/1997.III - No mesmo sentido, a Primeira Seção deste Superior Tribunal de Justiça, em julgamento sob o rito dos recursos repetitivos, assentou o seguinte entendimento no REsp 1.495.144/RS, no que diz respeito à correção monetária e aos juros: Nesse sentido: (REsp 1495144/RS, Rel. Ministro Mauro Campbell Marques, Primeira Seção, julgado em 22/2/2018, DJe 20/3/2018).IV - Quanto aos juros moratórios, tem-se que a Corte Estadual firmou entendimento em dissonância com o supracitado, ao garantir a aplicação do artigo 406 do CC/2002, motivo pelo qual merece reforma.Confira-se o trecho do acórdão recorrido: Vale dizer, não se trata de responsabilidade aquiliana, pois houve ajuste anterior entre as partes, sucedendo apenas que, no contrato firmado, não se estipulou taxa, razão de ser da aplicação da regra do artigo 406 do Código Civil, aplicando- se juros de mora de 1% ao mês. Fosse diferente, estar-se-ia estimulado a inadimplência, pois ao contratante seria sempre mais lucrativo pagar em juízo.V - Em relação à correção monetária, não foi a questão levada à Corte a quo em momento processual oportuno, motivo pelo qual não foi apreciada (fl. 327): Quanto à alegada incorreção dos índices de atualização monetária, veja-se que a Fazenda Pública não trouxe a questão na inicial dos embargos à execução, sendo-lhe vedado inovar em sede de apelação. Diga-se mais, a fls. 204 concordou com o índice aplicado pelo Contador Judicial.VI - O referido fundamento foi adotado de forma suficiente para manter o decisum recorrido e não foi rebatido no apelo nobre, o que atrai os óbices das Súmulas n. 283 e 284, ambas do STF (...).VII - Verifica-se que a irresignação do recorrente acerca do artigo 85, § 3º está vinculada à tese de que os honorários recursais arbitrados no acórdão recorrido à fl. 350 devem respeitar o patamar máximo de 10% previsto no inciso II do referido dispositivo, isso porque o proveito econômico destes autos é superior a 200 salários-mínimos, mas inferior a 2.000 salários mínimos. Disse o acórdão recorrido, na página citada: Enfim, considerada a presunção absoluta estabelecida pela referida regra legal (artigo 85, §11, do Código de Processo Civil), tenho por bem majorar em R$ 2.000,00 os honorários advocatícios fixados anteriormente, atento às regras do artigo 85, §11 (que reporta aos parágrafos 2° e 6°), do Código de Processo Civil.VIII - Se a decisão assinala que devem ser respeitadas as regras dos §§ 2º, 6º e 11, do art. 85, não há com o que o recorrente se preocupar, pois ficaram resguardados os limites previstos no § 3º, por expressa dicção do § 11. Falta, portanto, interesse recursal, no ponto.IX - Agravo interno improvido.",https://processo.stj.jus.br/SCON/GetInteiroTeorDoAcordao?num_registro=202001903308&dt_publicacao=07/10/2021,"PROCESSUAL CIVIL. ADMINISTRATIVO. LICITAÇÃO. CONTRATO. FORNECIMENTO DE PAINEL ELETRÔNICO PARA O MUNICÍPIO. VALOR CONTRATADO. EMBARGOS ÀEXECUÇÃO. IMPROCEDENCIA. JUROS MORATÓRIOS. CORREÇÃO MONETÁRIA. HONORÁRIOS ADVOCATÍCIOS RECURSAIS. ART 85, § 11 DO CPC/2015.I - Na origem, trata-se de embargos opostos pelo Município do Guarujá à execução ajuizada por Bruna Painéis Eletrônicos Ltda. objetivando a cobrança de valores pelo fornecimento de painel eletrônico para o estádio municipal. Na sentença, julgaram-se improcedentes os pedidos dos embargos. No Tribunal a quo, a sentença foi reformada para indeferir a petição inicial, por falta de interesse. Nesta Corte, conheceu-se do agravo para dar provimento ao recurso especial.II - A jurisprudência do Superior Tribunal de Justiça é firme no sentido de que os índices de correção monetária e de juros moratórios, foram definidos no julgamento do RE n. 870.947/SE, vinculado ao Tema 810/STF da repercussão geral, pelo plenário da Corte Suprema não tendo sido modulado os efeitos da decisão, mas tendo sido tão somente lhe dado eficácia prospectiva à declaração de inconstitucionalidade do índice previsto no artigo 1º-F da Lei n. 9.494/1997.III - No mesmo sentido, a Primeira Seção deste Superior Tribunal de Justiça, em julgamento sob o rito dos recursos repetitivos, assentou o seguinte entendimento no REsp 1.495.144/RS, no que diz respeito à correção monetária e aos juros: Nesse sentido: (REsp 1495144/RS, Rel. Ministro Mauro Campbell Marques, Primeira Seção, julgado em 22/2/2018, DJe 20/3/2018).IV - Quanto aos juros moratórios, tem-se que a Corte Estadual firmou entendimento em dissonância com o supracitado, ao garantir a aplicação do artigo 406 do CC/2002, motivo pelo qual merece reforma.Confira-se o trecho do acórdão recorrido: Vale dizer, não se trata de responsabilidade aquiliana, pois houve ajuste anterior entre as partes, sucedendo apenas que, no contrato firmado, não se estipulou taxa, razão de ser da aplicação da regra do artigo 406 do Código Civil, aplicando- se juros de mora de 1% ao mês. Fosse diferente, estar-se-ia estimulado a inadimplência, pois ao contratante seria sempre mais lucrativo pagar em juízo.V - Em relação à correção monetária, não foi a questão levada à Corte a quo em momento processual oportuno, motivo pelo qual não foi apreciada (fl. 327): Quanto à alegada incorreção dos índices de atualização monetária, veja-se que a Fazenda Pública não trouxe a questão na inicial dos embargos à execução, sendo-lhe vedado inovar em sede de apelação. Diga-se mais, a fls. 204 concordou com o índice aplicado pelo Contador Judicial.VI - O referido fundamento foi adotado de forma suficiente para manter o decisum recorrido e não foi rebatido no apelo nobre, o que atrai os óbices das Súmulas n. 283 e 284, ambas do STF (...).VII - Verifica-se que a irresignação do recorrente acerca do artigo 85, § 3º está vinculada à tese de que os honorários recursais arbitrados no acórdão recorrido à fl. 350 devem respeitar o patamar máximo de 10% previsto no inciso II do referido dispositivo, isso porque o proveito econômico destes autos é superior a 200 salários-mínimos, mas inferior a 2.000 salários mínimos. Disse o acórdão recorrido, na página citada: Enfim, considerada a presunção absoluta estabelecida pela referida regra legal (artigo 85, §11, do Código de Processo Civil), tenho por bem majorar em R$ 2.000,00 os honorários advocatícios fixados anteriormente, atento às regras do artigo 85, §11 (que reporta aos parágrafos 2° e 6°), do Código de Processo Civil.VIII - Se a decisão assinala que devem ser respeitadas as regras dos §§ 2º, 6º e 11, do art. 85, não há com o que o recorrente se preocupar, pois ficaram resguardados os limites previstos no § 3º, por expressa dicção do § 11. Falta, portanto, interesse recursal, no ponto.IX - Agravo interno improvido.","Vistos e relatados estes autos em que são partes as acima indicadas, acordam os Ministros da SEGUNDA TURMA do Superior Tribunal de Justiça, por unanimidade, negar provimento ao recurso, nos termos do voto do Sr. Ministro Relator.Os Srs. Ministros Herman Benjamin, Og Fernandes, Mauro Campbell Marques e Assusete Magalhães votaram com o Sr. Ministro Relator.Presidiu o julgamento o Sr. Ministro Herman Benjamin."
1754427,AIEERESP,Ministro BENEDITO GONÇALVES (1142),T1 - PRIMEIRA TURMA,27/09/2021,DJe 30/09/2021,"PROCESSUAL CIVIL E ADMINISTRATIVO. AGRAVO INTERNO NOS SEGUNDOSEMBARGOS DE DECLARAÇÃO. EXECUÇÃO CONTRA A FAZENDA PÚBLICA. TÍTULO EXECUTIVO JUDICIAL FORMADO ANTES DO INÍCIO DE VIGÊNCIA DA LEI N.11.960/2009, QUE ALTEROU O ART. 1º-F DA LEI N. 9.494/1997. CORREÇÃO MONETÁRIA E JUROS MORATORIOS. APLICAÇÃO IMEDIATA, NOS TERMOS DAS TESES DEFINIDAS PELA PRIMEIRA SEÇÃO DO SUPERIOR TRIBUNAL DE JUSTIÇA E PELO PLENO DO SUPREMO TRIBUNAL FEDERAL. INEXISTÊNCIA DE VIOLAÇÃO À COISA JULGADA.1. Este Tribunal Superior tem pacífico entendimento jurisprudencial pela possibilidade de, na fase de cumprimento de sentença, observarem-se as regras do art. 1º-F da Lei n. 9.494/1997, com a redação da Lei n. 11.960/2009 e com alterações decorrentes das decisões proferidas no REsp 1.495.144/RS e no RE 870.947/SE, sem caracterização de violação à coisa julgada, na hipótese em que não houver prévios debates sobre a aplicação da lei. Precedentes.2. No caso dos autos, está consignado na sentença de primeiro grau:""a sentença em execução foi proferida em 2008, antes da entrada em vigor da Lei n. 11.960/2009"" (fl. 39). Portanto, não há falar em violação à coisa julgada.3. Agravo interno não provido.",https://processo.stj.jus.br/SCON/GetInteiroTeorDoAcordao?num_registro=201801798915&dt_publicacao=30/09/2021,"PROCESSUAL CIVIL E ADMINISTRATIVO. AGRAVO INTERNO NOS SEGUNDOSEMBARGOS DE DECLARAÇÃO. EXECUÇÃO CONTRA A FAZENDA PÚBLICA. TÍTULO EXECUTIVO JUDICIAL FORMADO ANTES DO INÍCIO DE VIGÊNCIA DA LEI N.11.960/2009, QUE ALTEROU O ART. 1º-F DA LEI N. 9.494/1997. CORREÇÃO MONETÁRIA E JUROS MORATORIOS. APLICAÇÃO IMEDIATA, NOS TERMOS DAS TESES DEFINIDAS PELA PRIMEIRA SEÇÃO DO SUPERIOR TRIBUNAL DE JUSTIÇA E PELO PLENO DO SUPREMO TRIBUNAL FEDERAL. INEXISTÊNCIA DE VIOLAÇÃO À COISA JULGADA.1. Este Tribunal Superior tem pacífico entendimento jurisprudencial pela possibilidade de, na fase de cumprimento de sentença, observarem-se as regras do art. 1º-F da Lei n. 9.494/1997, com a redação da Lei n. 11.960/2009 e com alterações decorrentes das decisões proferidas no REsp 1.495.144/RS e no RE 870.947/SE, sem caracterização de violação à coisa julgada, na hipótese em que não houver prévios debates sobre a aplicação da lei. Precedentes.2. No caso dos autos, está consignado na sentença de primeiro grau:""a sentença em execução foi proferida em 2008, antes da entrada em vigor da Lei n. 11.960/2009"" (fl. 39). Portanto, não há falar em violação à coisa julgada.3. Agravo interno não provido.","Vistos e relatados estes autos em que são partes as acima indicadas, acordam os Ministros da PRIMEIRA TURMA do Superior Tribunal de Justiça, por unanimidade, negar provimento ao recurso, nos termos do voto do Sr. Ministro Relator.Os Srs. Ministros Sérgio Kukina, Regina Helena Costa, Gurgel de Faria e Manoel Erhardt (Desembargador convocado do TRF-5ª Região) votaram com o Sr. Ministro Relator.Presidiu o julgamento o Sr. Ministro Benedito Gonçalves."
1601652,RESP,Ministro BENEDITO GONÇALVES (1142),T1 - PRIMEIRA TURMA,21/09/2021,DJe 23/09/2021RSTJ vol. 263 p. 264,"PROCESSO CIVIL E ADMINISTRATIVO. RECURSO ESPECIAL. AÇÃO DE INDENIZAÇÃO POR DANOS MATERIAIS. ACIDENTE DE TRÂNSITO. COLISÃO EMVEÍCULO OFICIAL. CONDENAÇÃO EM FAVOR DA FAZENDA PÚBLICA ESTADUAL (CREDORA). JUROS DE MORA. INAPLICABILIDADE DO ARTIGO 1ºF DA LEI 9.494/97. INCIDÊNCIA DA REGRA GERAL DO ART. 406, DO CC/02.1. O art. 1°-F da Lei 9.494/97, consoante expressamente disposto na norma, aplica-se exclusivamente às condenações impostas à Fazenda Pública.2. Assim, considerando que o caso dos autos diz respeito à condenação decorrente de responsabilidade extracontratual de particular em favor da Fazenda Publica, ou seja, em que o Estado é credor, não há o que se falar em aplicação do regime previsto no referido artigo 1°-F da Lei 9.494/97, de forma que os juros de mora devem ser regidos pelo artigo 406 do CC, que, segundo a jurisprudência desta Corte, se refere à Taxa Selic. Precedentes.3. Recurso especial provido.",https://processo.stj.jus.br/SCON/GetInteiroTeorDoAcordao?num_registro=201601246658&dt_publicacao=23/09/2021,"PROCESSO CIVIL E ADMINISTRATIVO. RECURSO ESPECIAL. AÇÃO DE INDENIZAÇÃO POR DANOS MATERIAIS. ACIDENTE DE TRÂNSITO. COLISÃO EMVEÍCULO OFICIAL. CONDENAÇÃO EM FAVOR DA FAZENDA PÚBLICA ESTADUAL (CREDORA). JUROS DE MORA. INAPLICABILIDADE DO ARTIGO 1ºF DA LEI 9.494/97. INCIDÊNCIA DA REGRA GERAL DO ART. 406, DO CC/02.1. O art. 1°-F da Lei 9.494/97, consoante expressamente disposto na norma, aplica-se exclusivamente às condenações impostas à Fazenda Pública.2. Assim, considerando que o caso dos autos diz respeito à condenação decorrente de responsabilidade extracontratual de particular em favor da Fazenda Publica, ou seja, em que o Estado é credor, não há o que se falar em aplicação do regime previsto no referido artigo 1°-F da Lei 9.494/97, de forma que os juros de mora devem ser regidos pelo artigo 406 do CC, que, segundo a jurisprudência desta Corte, se refere à Taxa Selic. Precedentes.3. Recurso especial provido.","Vistos e relatados estes autos em que são partes as acima indicadas, acordam os Ministros da PRIMEIRA TURMA do Superior Tribunal de Justiça, por unanimidade, dar provimento ao recurso especial, nos termos do voto do Sr. Ministro Relator.Os Srs. Ministros Sérgio Kukina, Regina Helena Costa, Gurgel de Faria e Manoel Erhardt (Desembargador convocado do TRF-5ª Região) votaram com o Sr. Ministro Relator."
