processo,tipo_de_recurso,ministro_relator,orgao_julgador,data_do_julgamento,data_da_publicacao_fonte,tese_juridica,url_do_acordao,ementa,acordao
1931353,AINTARESP,Ministro FRANCISCO FALCÃO (1116),T2 - SEGUNDA TURMA,16/11/2021,DJe 18/11/2021,"PROCESSUAL CIVIL. PREVIDENCIÁRIO. ADICIONAL DE LOCAL DE EXERCÍCIO.PARCELAS VENCIDAS. PRESCRIÇÃO. NÃO OCORRÊNCIA. CORREÇÃO MONETÁRIA. IPCA-E. RECURSO ESPECIAL REPETITIVO N. 1.495.146/MG. TEMA N. 905/STJ. ACÓRDÃO RECORRIDO EM CONFRONTO COM A JURISPRUDÊNCIA DO STJ.I - Na origem, trata-se de ação ajuizada contra a São Paulo Previdência e o Estado de São Paulo objetivando o pagamento das parcelas vencidas, referentes ao Adicional de Local de Exercício - ALE. Na sentença, julgou-se improcedente o pedido pela ocorrência da prescrição. No Tribunal a quo, a sentença foi parcialmente reformada para afastar a prescrição e fixar os índices de correção monetária e dos juros de mora. Nesta Corte, conheceu-se do agravo para dar parcial provimento ao recurso especial em relação ao índice da correção monetária.II - A jurisprudência do Superior Tribunal de Justiça é firme no sentido de que a impetração de mandado de segurança interrompe a fluência do prazo prescricional, de modo que, após o trânsito em julgado da decisão nele proferida, voltará a fluir, pela metade, o prazo prescricional para o ajuizamento de Ação de Cobrança das parcelas referentes ao quinquênio que antecedeu a propositura do writ. Confira-se: (REsp 1.837.165/SP, relator Ministro Herman Benjamin, Segunda Turma, julgado em 7/11/2019, DJe 22/11/2019.)III - O acórdão recorrido alinha-se com entendimento firme na jurisprudência do Superior Tribunal de Justiça no ponto, aplica-se o enunciado da Súmula n. 568/STJ, segundo o qual ""O relator, monocraticamente e no STJ, poderá dar ou negar provimento ao recurso quando houver entendimento dominante acerca do tema"".IV - No tocante à correção monetária, merece amparo a insurgência recursal, tendo em vista que o Supremo Tribunal Federal, em repercussão geral, no julgamento do Recurso Extraordinário n. 870.947/SE (Tema 810/STF), assentou a compreensão de que o art. 1º-F da Lei n. 9.494/97, com a redação dada pela Lei n. 11.960/09, na parte em que disciplina a atualização monetária das condenações impostas à Fazenda Pública segundo a remuneração oficial da caderneta de poupança, revela-se inconstitucional ao impor restrição desproporcional ao direito de propriedade (CRFB, art. 5º, XXII), uma vez que não se qualifica como medida adequada para capturar a variação de preços da economia, sendo inidônea a promover os fins a que se destina, estabelecendo, ainda, que a correção monetária deve observar o IPCA-E.V - A jurisprudência do Superior Tribunal de Justiça consolidou-se no julgamento do Recurso Especial Repetitivo n. 1.495.146/MG, relator Ministro Mauro Campbell Marques, Primeira Seção (Tema n. 905/STJ). Nesse sentido: (EDcl no AgRg no REsp 1.221.069/RS, relator Ministro Sérgio Kukina, Primeira Turma, julgado em 3/3/2020, DJe 6/3/2020 e AgInt no RE no AgRg no REsp 1.411.245/SP, relatora Ministra Maria Thereza de Assis Moura, Corte Especial, julgado em 10/12/2019, DJe 13/12/2019.)VI - A matéria havia sido suspensa pelo STF nos Edcl no RE 870.947/SE, relator Min. Luiz Fux, mas apenas para fins de modulação dos efeitos temporais da decisão, tendo sido mantido o entendimento fixado quanto ao mérito. Contudo, o Tribunal, por maioria, rejeitou os embargos de declaração e não modulou os efeitos da decisão. Nesse sentido: (AgRg no REsp 1.492.381/RS, relator Ministro Napoleão Nunes Maia Filho, Primeira Turma, julgado em 9/6/2020, DJe 23/6/2020.)VII - Merece reparo o acórdão recorrido neste ponto, porquanto se encontra em dissonância com o decidido no julgamento do REsp.1.495.146/MG, relator Ministro Mauro Campbell Marques, DJe de 2/3/2018, acima mencionado.VIII - Agravo interno improvido.",https://processo.stj.jus.br/SCON/GetInteiroTeorDoAcordao?num_registro=202102052369&dt_publicacao=18/11/2021,"PROCESSUAL CIVIL. PREVIDENCIÁRIO. ADICIONAL DE LOCAL DE EXERCÍCIO.PARCELAS VENCIDAS. PRESCRIÇÃO. NÃO OCORRÊNCIA. CORREÇÃO MONETÁRIA. IPCA-E. RECURSO ESPECIAL REPETITIVO N. 1.495.146/MG. TEMA N. 905/STJ. ACÓRDÃO RECORRIDO EM CONFRONTO COM A JURISPRUDÊNCIA DO STJ.I - Na origem, trata-se de ação ajuizada contra a São Paulo Previdência e o Estado de São Paulo objetivando o pagamento das parcelas vencidas, referentes ao Adicional de Local de Exercício - ALE. Na sentença, julgou-se improcedente o pedido pela ocorrência da prescrição. No Tribunal a quo, a sentença foi parcialmente reformada para afastar a prescrição e fixar os índices de correção monetária e dos juros de mora. Nesta Corte, conheceu-se do agravo para dar parcial provimento ao recurso especial em relação ao índice da correção monetária.II - A jurisprudência do Superior Tribunal de Justiça é firme no sentido de que a impetração de mandado de segurança interrompe a fluência do prazo prescricional, de modo que, após o trânsito em julgado da decisão nele proferida, voltará a fluir, pela metade, o prazo prescricional para o ajuizamento de Ação de Cobrança das parcelas referentes ao quinquênio que antecedeu a propositura do writ. Confira-se: (REsp 1.837.165/SP, relator Ministro Herman Benjamin, Segunda Turma, julgado em 7/11/2019, DJe 22/11/2019.)III - O acórdão recorrido alinha-se com entendimento firme na jurisprudência do Superior Tribunal de Justiça no ponto, aplica-se o enunciado da Súmula n. 568/STJ, segundo o qual ""O relator, monocraticamente e no STJ, poderá dar ou negar provimento ao recurso quando houver entendimento dominante acerca do tema"".IV - No tocante à correção monetária, merece amparo a insurgência recursal, tendo em vista que o Supremo Tribunal Federal, em repercussão geral, no julgamento do Recurso Extraordinário n. 870.947/SE (Tema 810/STF), assentou a compreensão de que o art. 1º-F da Lei n. 9.494/97, com a redação dada pela Lei n. 11.960/09, na parte em que disciplina a atualização monetária das condenações impostas à Fazenda Pública segundo a remuneração oficial da caderneta de poupança, revela-se inconstitucional ao impor restrição desproporcional ao direito de propriedade (CRFB, art. 5º, XXII), uma vez que não se qualifica como medida adequada para capturar a variação de preços da economia, sendo inidônea a promover os fins a que se destina, estabelecendo, ainda, que a correção monetária deve observar o IPCA-E.V - A jurisprudência do Superior Tribunal de Justiça consolidou-se no julgamento do Recurso Especial Repetitivo n. 1.495.146/MG, relator Ministro Mauro Campbell Marques, Primeira Seção (Tema n. 905/STJ). Nesse sentido: (EDcl no AgRg no REsp 1.221.069/RS, relator Ministro Sérgio Kukina, Primeira Turma, julgado em 3/3/2020, DJe 6/3/2020 e AgInt no RE no AgRg no REsp 1.411.245/SP, relatora Ministra Maria Thereza de Assis Moura, Corte Especial, julgado em 10/12/2019, DJe 13/12/2019.)VI - A matéria havia sido suspensa pelo STF nos Edcl no RE 870.947/SE, relator Min. Luiz Fux, mas apenas para fins de modulação dos efeitos temporais da decisão, tendo sido mantido o entendimento fixado quanto ao mérito. Contudo, o Tribunal, por maioria, rejeitou os embargos de declaração e não modulou os efeitos da decisão. Nesse sentido: (AgRg no REsp 1.492.381/RS, relator Ministro Napoleão Nunes Maia Filho, Primeira Turma, julgado em 9/6/2020, DJe 23/6/2020.)VII - Merece reparo o acórdão recorrido neste ponto, porquanto se encontra em dissonância com o decidido no julgamento do REsp.1.495.146/MG, relator Ministro Mauro Campbell Marques, DJe de 2/3/2018, acima mencionado.VIII - Agravo interno improvido.","Vistos e relatados estes autos em que são partes as acima indicadas, acordam os Ministros da SEGUNDA TURMA do Superior Tribunal de Justiça, por unanimidade, negar provimento ao recurso, nos termos do voto do Sr. Ministro Relator.Os Srs. Ministros Herman Benjamin, Og Fernandes, Mauro Campbell Marques e Assusete Magalhães votaram com o Sr. Ministro Relator.Presidiu o julgamento o Sr. Ministro Herman Benjamin."
1943231,AIRESP,Ministro BENEDITO GONÇALVES (1142),T1 - PRIMEIRA TURMA,16/11/2021,DJe 18/11/2021,"PROCESSUAL CIVIL E ADMINISTRATIVO. AGRAVO INTERNO NO RECURSOESPECIAL. SERVIDOR PÚBLICO ESTADUAL. OBSERVÂNCIA DA CORREÇÃO MONETÁRIA EM SEDE DE REEXAME NECESSÁRIO. NÃO OCORRÊNCIA DE VIOLAÇÃO AO PRINCÍPIO DO NON REFORMATIO IN PEJUS.1. Tendo o recurso sido interposto contra decisão publicada na vigência do Código de Processo Civil de 1973, devem ser exigidos os requisitos de admissibilidade na forma nele previsto, conforme Enunciado Administrativo 2/2016/STJ.2. A correção monetária, assim como os juros de mora, incide sobre o objeto da condenação judicial e não se prende a pedido feito em primeira instância ou a recurso voluntário dirigido à Corte de origem. É matéria de ordem pública, cognoscível de ofício em sede de reexame necessário.3. A explicitação do modo em que a correção monetária deverá incidir feita em sede de reexame de ofício não caracteriza reformatio in pejus contra a Fazenda Pública, tampouco ofende o princípio da inércia da jurisdição. Precedentes.4. Agravo interno não provido.",https://processo.stj.jus.br/SCON/GetInteiroTeorDoAcordao?num_registro=202101675930&dt_publicacao=18/11/2021,"PROCESSUAL CIVIL E ADMINISTRATIVO. AGRAVO INTERNO NO RECURSOESPECIAL. SERVIDOR PÚBLICO ESTADUAL. OBSERVÂNCIA DA CORREÇÃO MONETÁRIA EM SEDE DE REEXAME NECESSÁRIO. NÃO OCORRÊNCIA DE VIOLAÇÃO AO PRINCÍPIO DO NON REFORMATIO IN PEJUS.1. Tendo o recurso sido interposto contra decisão publicada na vigência do Código de Processo Civil de 1973, devem ser exigidos os requisitos de admissibilidade na forma nele previsto, conforme Enunciado Administrativo 2/2016/STJ.2. A correção monetária, assim como os juros de mora, incide sobre o objeto da condenação judicial e não se prende a pedido feito em primeira instância ou a recurso voluntário dirigido à Corte de origem. É matéria de ordem pública, cognoscível de ofício em sede de reexame necessário.3. A explicitação do modo em que a correção monetária deverá incidir feita em sede de reexame de ofício não caracteriza reformatio in pejus contra a Fazenda Pública, tampouco ofende o princípio da inércia da jurisdição. Precedentes.4. Agravo interno não provido.","Vistos e relatados estes autos em que são partes as acima indicadas, acordam os Ministros da PRIMEIRA TURMA do Superior Tribunal de Justiça, por unanimidade, negar provimento ao recurso, nos termos do voto do Sr. Ministro Relator.Os Srs. Ministros Sérgio Kukina, Regina Helena Costa, Gurgel de Faria e Manoel Erhardt (Desembargador convocado do TRF-5ª Região) votaram com o Sr. Ministro Relator.Presidiu o julgamento o Sr. Ministro Benedito Gonçalves."
1951387,RESP,Ministro HERMAN BENJAMIN (1132),T2 - SEGUNDA TURMA,14/09/2021,DJe 05/11/2021,"PREVIDENCIÁRIO E PROCESSUAL CIVIL. CONDENAÇÕES IMPOSTAS AO INSS.JUROS DE MORA E CORREÇÃO MONETÁRIA. REPERCUSSÃO GERAL. CONSTITUCIONALIDADE.1. A discussão travada nos autos diz respeito à aplicação imediata do art. 1°-F da Lei 9.494/1997, com a redação dada pela Lei 11.960/2009, que estabclece critérios de atualização monetária e compensação da mora nas condenações impostas à Fazenda Pública.2. O STF, ao julgar a ADI 4.357/DF e a ADI 4.425/DF, assim como o RE 870.947/SE, em Regime de Repercussão Geral, considerou constitucional a incidência de juros de mora com base no índice oficial de remuneração da caderneta de poupança, nas condenações impostas à Fazenda Pública, excepcionados os débitos de natureza tributária.3. Nesse contexto, afastou-se a aplicação do art. 1°-F da Lei 9.497/1997, com a redação dada pela Lei 11.960/2009, para fins de correção monetária sobre débito de qualquer natureza, mantida sua incidência no que concerne à fixação dos juros de mora, salvo em relação a débitos oriundos de relação juridico-tributária.4. As condenações judiciais referentes aos débitos previdenciários sujeitam-se à incidência do INPC, ""para fins de correção monetária, no que se refere ao período posterior à vigência da Lei 11.430/2006, que incluiu o art. 41-A na Lei 8.213/1991. Quanto aos juros de mora, incidem segundo a remuneração oficial da caderneta de poupança (art.1°-F da Lei 9.494/97, com redação dada pela Lei 11.960/2009)"".5. Recurso Especial não provido.",https://processo.stj.jus.br/SCON/GetInteiroTeorDoAcordao?num_registro=202102352292&dt_publicacao=05/11/2021,"PREVIDENCIÁRIO E PROCESSUAL CIVIL. CONDENAÇÕES IMPOSTAS AO INSS.JUROS DE MORA E CORREÇÃO MONETÁRIA. REPERCUSSÃO GERAL. CONSTITUCIONALIDADE.1. A discussão travada nos autos diz respeito à aplicação imediata do art. 1°-F da Lei 9.494/1997, com a redação dada pela Lei 11.960/2009, que estabclece critérios de atualização monetária e compensação da mora nas condenações impostas à Fazenda Pública.2. O STF, ao julgar a ADI 4.357/DF e a ADI 4.425/DF, assim como o RE 870.947/SE, em Regime de Repercussão Geral, considerou constitucional a incidência de juros de mora com base no índice oficial de remuneração da caderneta de poupança, nas condenações impostas à Fazenda Pública, excepcionados os débitos de natureza tributária.3. Nesse contexto, afastou-se a aplicação do art. 1°-F da Lei 9.497/1997, com a redação dada pela Lei 11.960/2009, para fins de correção monetária sobre débito de qualquer natureza, mantida sua incidência no que concerne à fixação dos juros de mora, salvo em relação a débitos oriundos de relação juridico-tributária.4. As condenações judiciais referentes aos débitos previdenciários sujeitam-se à incidência do INPC, ""para fins de correção monetária, no que se refere ao período posterior à vigência da Lei 11.430/2006, que incluiu o art. 41-A na Lei 8.213/1991. Quanto aos juros de mora, incidem segundo a remuneração oficial da caderneta de poupança (art.1°-F da Lei 9.494/97, com redação dada pela Lei 11.960/2009)"".5. Recurso Especial não provido.","Vistos, relatados e discutidos os autos em que são partes as acima indicadas, acordam os Ministros da Segunda Turma do Superior Tribunal de Justiça: """"A Turma, por unanimidade, negou provimento ao recurso, nos termos do voto do(a) Sr(a). Ministro(a)-Relator(a).""Os Srs. Ministros Og Fernandes, Mauro Campbell Marques, Assusete Magalhães e Francisco Falcão votaram com o Sr. Ministro Relator."""
1918364,AIAIRESP,Ministro HERMAN BENJAMIN (1132),T2 - SEGUNDA TURMA,25/10/2021,DJe 04/11/2021,"PROCESSUAL CIVIL. AGRAVO INTERNO NO AGRAVO INTERNO NO RECURSOESPECIAL. SERVIDOR PÚBLICO. CONDENAÇÃO IMPOSTA À FAZENDA PÚBLICA. ARTIGO 1º-F DA LEI 9.494/1997, COM A REDAÇÃO DADA PELA LEI11.960/2009. INAPLICABILIDADE DA TR COMO FATOR DE CORREÇÃO MONETÁRIA. RESP 1.495.144/RS E RE 870.947/SE.1. O Supremo Tribunal Federal examinou as questões advindas da aplicação de juros e correção monetária sobre os débitos da Fazenda Pública em decorrência da vigência do art. 1º-F da Lei 9.494/1997, introduzido pela MP 2.180-35/2001, e da posterior alteração pela Lei 11.960/2009, representadas pelos Temas 435 e 810/STF.2. Acrescente-se, ainda, que o Supremo Tribunal Federal, no julgamento de Embargos de Declaração no RE 870.947/SE, rejeitou a possibilidade de modulação dos efeitos do julgado.3. Com o trânsito em julgado da decisão proferida pelo Supremo Tribunal Federal no âmbito do RE 870.947/SE (Tema 810), submetido à sistemática da Repercussão Geral, ocorrido em 3.3.2020 (e certificado em 31.3.2020), pacificou-se o entendimento no sentido de que deve ser aplicada a variação do IPCA-E em todo o período de atualização.4. Observando a decisão do STF, a Primeira Seção do STJ, no julgamento do REsp 1.495.146/MG, Rel. Min. Mauro Campbell Marques, reexaminando a questão relativa à aplicação do art. 1º-F da Lei 9.494/1997, com a redação dada pela Lei 11.960/2009, estabeleceu que as condenações judiciais referentes a servidores e empregados públicos se sujeitam aos seguintes encargos: ""(a) até julho/2001:juros de mora: 1% ao mês (capitalização simples); correção monetária: índices previstos no Manual de Cálculos da Justiça Federal, com destaque para a incidência do IPCA-E a partir de janeiro/2001; (b) agosto/2001 a junho/2009: juros de mora: 0,5% ao mês; correção monetária: IPCA-E; (c) a partir de julho/2009: juros de mora: remuneração oficial da caderneta de poupança; correção monetária: IPCA-E."" (Tema 905/STJ) 5. Não merece reparos o acórdão do TJ/RJ, porquanto segue a sistemática do decidido no julgamento do REsp 1.495.146/MG, Rel. Min. Mauro Campbell Marques, DJe de 2.3.2018, acima mencionado.6. Dessa forma, não é possível considerar a TR como índice de correção monetária nas condenações impostas contra a Fazenda Pública, conforme pleiteado pelo Estado 7. Agravo Interno não provido.",https://processo.stj.jus.br/SCON/GetInteiroTeorDoAcordao?num_registro=202100240003&dt_publicacao=04/11/2021,"PROCESSUAL CIVIL. AGRAVO INTERNO NO AGRAVO INTERNO NO RECURSOESPECIAL. SERVIDOR PÚBLICO. CONDENAÇÃO IMPOSTA À FAZENDA PÚBLICA. ARTIGO 1º-F DA LEI 9.494/1997, COM A REDAÇÃO DADA PELA LEI11.960/2009. INAPLICABILIDADE DA TR COMO FATOR DE CORREÇÃO MONETÁRIA. RESP 1.495.144/RS E RE 870.947/SE.1. O Supremo Tribunal Federal examinou as questões advindas da aplicação de juros e correção monetária sobre os débitos da Fazenda Pública em decorrência da vigência do art. 1º-F da Lei 9.494/1997, introduzido pela MP 2.180-35/2001, e da posterior alteração pela Lei 11.960/2009, representadas pelos Temas 435 e 810/STF.2. Acrescente-se, ainda, que o Supremo Tribunal Federal, no julgamento de Embargos de Declaração no RE 870.947/SE, rejeitou a possibilidade de modulação dos efeitos do julgado.3. Com o trânsito em julgado da decisão proferida pelo Supremo Tribunal Federal no âmbito do RE 870.947/SE (Tema 810), submetido à sistemática da Repercussão Geral, ocorrido em 3.3.2020 (e certificado em 31.3.2020), pacificou-se o entendimento no sentido de que deve ser aplicada a variação do IPCA-E em todo o período de atualização.4. Observando a decisão do STF, a Primeira Seção do STJ, no julgamento do REsp 1.495.146/MG, Rel. Min. Mauro Campbell Marques, reexaminando a questão relativa à aplicação do art. 1º-F da Lei 9.494/1997, com a redação dada pela Lei 11.960/2009, estabeleceu que as condenações judiciais referentes a servidores e empregados públicos se sujeitam aos seguintes encargos: ""(a) até julho/2001:juros de mora: 1% ao mês (capitalização simples); correção monetária: índices previstos no Manual de Cálculos da Justiça Federal, com destaque para a incidência do IPCA-E a partir de janeiro/2001; (b) agosto/2001 a junho/2009: juros de mora: 0,5% ao mês; correção monetária: IPCA-E; (c) a partir de julho/2009: juros de mora: remuneração oficial da caderneta de poupança; correção monetária: IPCA-E."" (Tema 905/STJ) 5. Não merece reparos o acórdão do TJ/RJ, porquanto segue a sistemática do decidido no julgamento do REsp 1.495.146/MG, Rel. Min. Mauro Campbell Marques, DJe de 2.3.2018, acima mencionado.6. Dessa forma, não é possível considerar a TR como índice de correção monetária nas condenações impostas contra a Fazenda Pública, conforme pleiteado pelo Estado 7. Agravo Interno não provido.","Vistos e relatados estes autos em que são partes as acima indicadas, acordam os Ministros da SEGUNDA TURMA do Superior Tribunal de Justiça, por unanimidade, negar provimento ao recurso, nos termos do voto do Sr. Ministro Relator.Os Srs. Ministros Francisco Falcão, Og Fernandes, Mauro Campbell Marques e Assusete Magalhães votaram com o Sr. Ministro Relator.Presidiu o julgamento o Sr. Ministro Herman Benjamin."
1894435,AINTARESP,Ministro FRANCISCO FALCÃO (1116),T2 - SEGUNDA TURMA,25/10/2021,DJe 28/10/2021,"PROCESSUAL CIVIL. AÇÃO ORDINÁRIA. AÇÃO DE COBRANÇA. DESCONTOS INDEVIDOS EM CONTRACHEQUE. PEDIDOS PARCIALMENTE PROCEDENTES. DANOSMORAIS. IMPOSSIBILIDADE. EXTINÇÃO DO PROCESSO. JUROS DE MORA A PARTIR DA CITAÇÃO. CORREÇÃO MONETÁRIA DESDE OS DESCONTOS INDEVIDOS. SUCUMBÊNCIA RECÍPROCA. NÃO CONHECIMENTO DO AGRAVO EM RECURSO ESPECIAL QUE NÃO ATACA OS FUNDAMENTOS DA DECISÃO RECORRIDA.I - Na origem, trata-se de ação ordinária em que se pleiteia cobrança contra o Fundo de Previdência Social dos Servidores do Município de Santo Antônio do Descoberto ? SADPREV, sob a alegação de realização de descontos indevidos em contracheque, consubstanciados no cômputo de gratificações de caráter transitório para cálculo da contribuição previdenciária, bem como indenização por danos morais. Na sentença, julgou-se parcialmente procedente o pedido, para condenar a SADPREV a realizar o pagamento devido, extinguindo-se o processo. No Tribunal a quo, a sentença foi reformada para estabelecer que os juros de mora devem incidir a partir da citação do ente público, à luz dos índices oficiais aplicáveis à caderneta de poupança, enquanto que a correção monetária será devida desde quando houve os descontos indevidos por parte da Fazenda Pública, bem como reconhecer a sucumbência recíproca. Mediante análise dos autos, verifica-se que a decisão inadmitiu o recurso especial com base na incidência da Súmula n. 7/STJ. Entretanto, a parte agravante deixou de impugnar especificamente o referido óbice.II - São insuficientes para considerar como impugnação aos fundamentos da decisão que inadmite o recurso especial na origem:meras alegações genéricas sobre as razões que levaram à negativa de seguimento, o combate genérico e não específico e a simples menção a normas infraconstitucionais, feita de maneira esparsa e assistemática no corpo das razões do agravo em recurso especial.III - Incumbe à parte, no agravo em recurso especial, atacar os fundamentos da decisão que negou seguimento ao recurso na origem.Não o fazendo, é correta a decisão que não conhece do agravo nos próprios autos.IV - Agravo interno improvido.",https://processo.stj.jus.br/SCON/GetInteiroTeorDoAcordao?num_registro=202101390668&dt_publicacao=28/10/2021,"PROCESSUAL CIVIL. AÇÃO ORDINÁRIA. AÇÃO DE COBRANÇA. DESCONTOS INDEVIDOS EM CONTRACHEQUE. PEDIDOS PARCIALMENTE PROCEDENTES. DANOSMORAIS. IMPOSSIBILIDADE. EXTINÇÃO DO PROCESSO. JUROS DE MORA A PARTIR DA CITAÇÃO. CORREÇÃO MONETÁRIA DESDE OS DESCONTOS INDEVIDOS. SUCUMBÊNCIA RECÍPROCA. NÃO CONHECIMENTO DO AGRAVO EM RECURSO ESPECIAL QUE NÃO ATACA OS FUNDAMENTOS DA DECISÃO RECORRIDA.I - Na origem, trata-se de ação ordinária em que se pleiteia cobrança contra o Fundo de Previdência Social dos Servidores do Município de Santo Antônio do Descoberto ? SADPREV, sob a alegação de realização de descontos indevidos em contracheque, consubstanciados no cômputo de gratificações de caráter transitório para cálculo da contribuição previdenciária, bem como indenização por danos morais. Na sentença, julgou-se parcialmente procedente o pedido, para condenar a SADPREV a realizar o pagamento devido, extinguindo-se o processo. No Tribunal a quo, a sentença foi reformada para estabelecer que os juros de mora devem incidir a partir da citação do ente público, à luz dos índices oficiais aplicáveis à caderneta de poupança, enquanto que a correção monetária será devida desde quando houve os descontos indevidos por parte da Fazenda Pública, bem como reconhecer a sucumbência recíproca. Mediante análise dos autos, verifica-se que a decisão inadmitiu o recurso especial com base na incidência da Súmula n. 7/STJ. Entretanto, a parte agravante deixou de impugnar especificamente o referido óbice.II - São insuficientes para considerar como impugnação aos fundamentos da decisão que inadmite o recurso especial na origem:meras alegações genéricas sobre as razões que levaram à negativa de seguimento, o combate genérico e não específico e a simples menção a normas infraconstitucionais, feita de maneira esparsa e assistemática no corpo das razões do agravo em recurso especial.III - Incumbe à parte, no agravo em recurso especial, atacar os fundamentos da decisão que negou seguimento ao recurso na origem.Não o fazendo, é correta a decisão que não conhece do agravo nos próprios autos.IV - Agravo interno improvido.","Vistos e relatados estes autos em que são partes as acima indicadas, acordam os Ministros da SEGUNDA TURMA do Superior Tribunal de Justiça, por unanimidade, negar provimento ao recurso, nos termos do voto do Sr. Ministro Relator.Os Srs. Ministros Herman Benjamin, Og Fernandes, Mauro Campbell Marques e Assusete Magalhães votaram com o Sr. Ministro Relator.Presidiu o julgamento o Sr. Ministro Herman Benjamin."
