processo,tipo_de_recurso,ministro_relator,orgao_julgador,data_do_julgamento,data_da_publicacao_fonte,tese_juridica,url_do_acordao,ementa,acordao
1902479,AIRESP,Ministro TEODORO SILVA SANTOS (1186),T2 - SEGUNDA TURMA,14/05/2024,DJe 20/05/2024,"AGRAVO INTERNO NO RECURSO ESPECIAL. PROCESSUAL CIVIL. CONDENAÇÕESJUDICIAIS CONTRA A FAZENDA PÚBLICA. RELAÇÃO JURÍDICA NÃO TRIBUTÁRIA.JUROS DE MORA. PARÂMETROS. ALTERAÇÃO. POSSIBILIDADE. ART. 1º-F DA LEI 9.494/1997 COM A REDAÇÃO DADA PELA LEI 11.960/2009. OBSERVÂNCIA IMEDIATA. SUPERVENIÊNCIA DA EMENDA CONSTITUCIONAL 113/2021.APLICABILIDADE DE OFÍCIO. MATÉRIA DE ORDEM PÚBLICA. AGRAVO INTERNO PROVIDO.1. O Supremo Tribunal Federal, após a interposição do presente agravo, afetou o RE 1.317.982 com a finalidade de uniformizar a controvérsia acerca da ""validade dos juros moratórios aplicáveis nas condenações da Fazenda Pública, em virtude da tese firmada no RE 870.947 (Tema 810), na execução de título judicial que tenha fixado expressamente índice diverso."" No referido julgamento, foi fixada a tese correspondente ao Tema 1.170 no sentido de ser ""aplicável às condenações da Fazenda Pública envolvendo relações jurídicas não tributárias o índice de juros moratórios estabelecido no art. 1º-F da Lei n. 9.494/1997, na redação dada pela Lei n. 11.960/2009, a partir da vigência da referida legislação, mesmo havendo previsão diversa em título executivo judicial transitado em julgado.""2. Por outro lado, o acórdão recorrido determinou a incidência de juros de mora e de correção monetária nos termos da legislação vigente à época dos fatos. Assim, em face do julgado acima referenciado, cumpre adequar a decisão atacada aos precedentes vinculantes das Cortes de vértice, aplicando o regime de juros moratórios da atual redação do art. 1º-F da Lei n. 9.494/1997, mas somente no período imediatamente seguinte à entrada em vigor da Lei n. 11.960/2009, até a data da promulgação da Emenda Constitucional n. 113/2021.3. Em suma, os juros de mora, no caso concreto, incidem nos seguintes termos: (i) relativamente ao período posterior à vigência do CC/2002 e anterior à vigência da Lei n. 11.960/2009, juros de mora correspondentes à taxa Selic, vedada a cumulação com qualquer outro índice; (ii) quanto ao período posterior à vigência da Lei n. 11.960/2009, incidem juros de mora segundo o índice de remuneração da caderneta de poupança (com a ressalva destacada no parágrafo anterior); e (iii) para as parcelas vencidas a partir de 9/12/2021, é de se fixar a Selic, nos termos do art. 3º da EC n. 113/2021.4. A propósito da correção monetária, conforme estabelecido no julgamento repetitivo do Tema 905 deste Superior Tribunal de Justiça, inaplicável a redação do art. 1º-F da Lei 9.494/2007, por ter sido declarada inconstitucional neste ponto. Portanto, deve ser observada a aplicação de índices capazes de captar o fenômeno inflacionário, até o advento da citada Emenda, ocasião em que prevalecerá ""a incidência, uma única vez, até o efetivo pagamento, do índice da taxa referencial do Sistema Especial de Liquidação e de Custódia (Selic), acumulado mensalmente.""5. Agravo interno provido.",https://processo.stj.jus.br/SCON/GetInteiroTeorDoAcordao?num_registro=202002790236&dt_publicacao=20/05/2024,"AGRAVO INTERNO NO RECURSO ESPECIAL. PROCESSUAL CIVIL. CONDENAÇÕESJUDICIAIS CONTRA A FAZENDA PÚBLICA. RELAÇÃO JURÍDICA NÃO TRIBUTÁRIA.JUROS DE MORA. PARÂMETROS. ALTERAÇÃO. POSSIBILIDADE. ART. 1º-F DA LEI 9.494/1997 COM A REDAÇÃO DADA PELA LEI 11.960/2009. OBSERVÂNCIA IMEDIATA. SUPERVENIÊNCIA DA EMENDA CONSTITUCIONAL 113/2021.APLICABILIDADE DE OFÍCIO. MATÉRIA DE ORDEM PÚBLICA. AGRAVO INTERNO PROVIDO.1. O Supremo Tribunal Federal, após a interposição do presente agravo, afetou o RE 1.317.982 com a finalidade de uniformizar a controvérsia acerca da ""validade dos juros moratórios aplicáveis nas condenações da Fazenda Pública, em virtude da tese firmada no RE 870.947 (Tema 810), na execução de título judicial que tenha fixado expressamente índice diverso."" No referido julgamento, foi fixada a tese correspondente ao Tema 1.170 no sentido de ser ""aplicável às condenações da Fazenda Pública envolvendo relações jurídicas não tributárias o índice de juros moratórios estabelecido no art. 1º-F da Lei n. 9.494/1997, na redação dada pela Lei n. 11.960/2009, a partir da vigência da referida legislação, mesmo havendo previsão diversa em título executivo judicial transitado em julgado.""2. Por outro lado, o acórdão recorrido determinou a incidência de juros de mora e de correção monetária nos termos da legislação vigente à época dos fatos. Assim, em face do julgado acima referenciado, cumpre adequar a decisão atacada aos precedentes vinculantes das Cortes de vértice, aplicando o regime de juros moratórios da atual redação do art. 1º-F da Lei n. 9.494/1997, mas somente no período imediatamente seguinte à entrada em vigor da Lei n. 11.960/2009, até a data da promulgação da Emenda Constitucional n. 113/2021.3. Em suma, os juros de mora, no caso concreto, incidem nos seguintes termos: (i) relativamente ao período posterior à vigência do CC/2002 e anterior à vigência da Lei n. 11.960/2009, juros de mora correspondentes à taxa Selic, vedada a cumulação com qualquer outro índice; (ii) quanto ao período posterior à vigência da Lei n. 11.960/2009, incidem juros de mora segundo o índice de remuneração da caderneta de poupança (com a ressalva destacada no parágrafo anterior); e (iii) para as parcelas vencidas a partir de 9/12/2021, é de se fixar a Selic, nos termos do art. 3º da EC n. 113/2021.4. A propósito da correção monetária, conforme estabelecido no julgamento repetitivo do Tema 905 deste Superior Tribunal de Justiça, inaplicável a redação do art. 1º-F da Lei 9.494/2007, por ter sido declarada inconstitucional neste ponto. Portanto, deve ser observada a aplicação de índices capazes de captar o fenômeno inflacionário, até o advento da citada Emenda, ocasião em que prevalecerá ""a incidência, uma única vez, até o efetivo pagamento, do índice da taxa referencial do Sistema Especial de Liquidação e de Custódia (Selic), acumulado mensalmente.""5. Agravo interno provido.","Vistos e relatados estes autos em que são partes as acima indicadas, acordam os Ministros da Segunda Turma, por unanimidade, deu provimento ao agravo interno, nos termos do voto do Sr. Ministro Relator.Os Srs. Ministros Afrânio Vilela, Francisco Falcão, Herman Benjamin e Mauro Campbell Marques votaram com o Sr. Ministro Relator."
2057570,AIEDRESP,,T1 - PRIMEIRA TURMA,13/05/2024,DJe 16/05/2024,"PROCESSUAL CIVIL. EXECUÇÃO DE SENTENÇA. AGRAVO INTERNO NOS EMBARGOS DE DECLARAÇÃO NO RECURSO ESPECIAL. CÓDIGO DE PROCESSO CIVIL DE 2015.APLICABILIDADE. CORREÇÃO MONETÁRIA E JUROS DE MORA. PARCELAS DE NATUREZA PROCESSUAL. LEI N. 11.960/2009, QUE ALTEROU O ARTIGO 1º-F DA LEI 9.494/97. APLICAÇÃO IMEDIATA. PRINCÍPIO DO TEMPUS REGIT ACTUM. ARGUMENTOS INSUFICIENTES PARA DESCONSTITUIR A DECISÃO ATACADA. APLICAÇÃO DE MULTA. ART. 1.021, § 4º, DO CÓDIGO DE PROCESSO CIVIL DE 2015. DESCABIMENTO.I - Consoante o decidido pelo Plenário desta Corte na sessão realizada em 09.03.2016, o regime recursal será determinado pela data da publicação do provimento jurisdicional impugnado. In casu, aplica-se o Código de Processo Civil de 2015.II - A Corte Especial deste Tribunal Superior, em regime de recursos repetitivos, firmou orientação no sentido de que a correção monetária e os juros de mora constituem parcelas de natureza processual, razão pela qual a alteração introduzida pela Lei n. 11.960/2009 se aplica, de imediato, aos processos em curso, relativamente ao período posterior à sua vigência, à luz do princípio tempus regit actum (cf. Temas ns. 491 e 492, REsp n. 1.205.946/SP, Relator Ministro BENEDITO GONÇALVES, j. 19.10.2011, DJe 2.2.2012).III - A partir de tal compreensão, conclui-se que, na fase de execução, a coisa julgada não impede a aplicação da Lei n. 11.960/2009 no tocante aos títulos formados anteriormente à sua vigência ou quando, no processo de conhecimento, embora transitado em julgado a posteriori, não se debateu sobre a incidência de tal norma por motivo não imputável à parte interessada (cf. 1ª Turma, AgInt no AREsp 1.696.441/RS, Rel. Ministro SÉRGIO KUKINA, j.23.2.2021, DJe 26.2.2021; 2ª Turma, AgInt no REsp 1.904.433/SC, Rel. Ministro HERMAN BENJAMIN, j. 15.3.2021, DJe 19.3.2021).IV - A EC n. 62/2009 deu nova redação ao art. 100, § 12, da Constituição da República, passando a prever, após a inscrição de valores em precatório, e para fins de compensação da mora, a incidência de ""[...] juros simples no mesmo percentual de juros incidentes sobre a caderneta de poupança"".V - Tal regramento foi declarado constitucional pelo Supremo Tribunal Federal no julgamento conjunto das ADI's ns. 4.357/DF e 4.425/DF, ocasião na qual afastada a incidência dos juros de mora aplicáveis à caderneta de poupança apenas aos precatórios oriundos de relações tributárias, em razão do princípio da isonomia, mantida a incidência do art. 1º-F da Lei n. 9.494/1997, na redação conferida pela Lei n. 11.960/2009, quanto aos requisitórios de natureza distinta.VI - O Agravante não apresenta, no agravo, argumentos suficientes para desconstituir a decisão recorrida.VII - Em regra, descabe a imposição da multa prevista no art. 1.021, § 4º, do Código de Processo Civil de 2015 em razão do mero desprovimento do Agravo Interno em votação unânime, sendo necessária a configuração da manifesta inadmissibilidade ou improcedência do recurso a autorizar sua aplicação, o que não ocorreu no caso.VIII - Agravo Interno improvido.",https://processo.stj.jus.br/SCON/GetInteiroTeorDoAcordao?num_registro=202101550701&dt_publicacao=16/05/2024,"PROCESSUAL CIVIL. EXECUÇÃO DE SENTENÇA. AGRAVO INTERNO NOS EMBARGOS DE DECLARAÇÃO NO RECURSO ESPECIAL. CÓDIGO DE PROCESSO CIVIL DE 2015.APLICABILIDADE. CORREÇÃO MONETÁRIA E JUROS DE MORA. PARCELAS DE NATUREZA PROCESSUAL. LEI N. 11.960/2009, QUE ALTEROU O ARTIGO 1º-F DA LEI 9.494/97. APLICAÇÃO IMEDIATA. PRINCÍPIO DO TEMPUS REGIT ACTUM. ARGUMENTOS INSUFICIENTES PARA DESCONSTITUIR A DECISÃO ATACADA. APLICAÇÃO DE MULTA. ART. 1.021, § 4º, DO CÓDIGO DE PROCESSO CIVIL DE 2015. DESCABIMENTO.I - Consoante o decidido pelo Plenário desta Corte na sessão realizada em 09.03.2016, o regime recursal será determinado pela data da publicação do provimento jurisdicional impugnado. In casu, aplica-se o Código de Processo Civil de 2015.II - A Corte Especial deste Tribunal Superior, em regime de recursos repetitivos, firmou orientação no sentido de que a correção monetária e os juros de mora constituem parcelas de natureza processual, razão pela qual a alteração introduzida pela Lei n. 11.960/2009 se aplica, de imediato, aos processos em curso, relativamente ao período posterior à sua vigência, à luz do princípio tempus regit actum (cf. Temas ns. 491 e 492, REsp n. 1.205.946/SP, Relator Ministro BENEDITO GONÇALVES, j. 19.10.2011, DJe 2.2.2012).III - A partir de tal compreensão, conclui-se que, na fase de execução, a coisa julgada não impede a aplicação da Lei n. 11.960/2009 no tocante aos títulos formados anteriormente à sua vigência ou quando, no processo de conhecimento, embora transitado em julgado a posteriori, não se debateu sobre a incidência de tal norma por motivo não imputável à parte interessada (cf. 1ª Turma, AgInt no AREsp 1.696.441/RS, Rel. Ministro SÉRGIO KUKINA, j.23.2.2021, DJe 26.2.2021; 2ª Turma, AgInt no REsp 1.904.433/SC, Rel. Ministro HERMAN BENJAMIN, j. 15.3.2021, DJe 19.3.2021).IV - A EC n. 62/2009 deu nova redação ao art. 100, § 12, da Constituição da República, passando a prever, após a inscrição de valores em precatório, e para fins de compensação da mora, a incidência de ""[...] juros simples no mesmo percentual de juros incidentes sobre a caderneta de poupança"".V - Tal regramento foi declarado constitucional pelo Supremo Tribunal Federal no julgamento conjunto das ADI's ns. 4.357/DF e 4.425/DF, ocasião na qual afastada a incidência dos juros de mora aplicáveis à caderneta de poupança apenas aos precatórios oriundos de relações tributárias, em razão do princípio da isonomia, mantida a incidência do art. 1º-F da Lei n. 9.494/1997, na redação conferida pela Lei n. 11.960/2009, quanto aos requisitórios de natureza distinta.VI - O Agravante não apresenta, no agravo, argumentos suficientes para desconstituir a decisão recorrida.VII - Em regra, descabe a imposição da multa prevista no art. 1.021, § 4º, do Código de Processo Civil de 2015 em razão do mero desprovimento do Agravo Interno em votação unânime, sendo necessária a configuração da manifesta inadmissibilidade ou improcedência do recurso a autorizar sua aplicação, o que não ocorreu no caso.VIII - Agravo Interno improvido.","Vistos e relatados estes autos em que são partes as acima indicadas, acordam os Ministros da PRIMEIRA TURMA do Superior Tribunal de Justiça, em sessão virtual de 07/05/2024 a 13/05/2024, por unanimidade, negar provimento ao recurso, nos termos do voto da Sra. Ministra Relatora.Os Srs. Ministros Benedito Gonçalves, Sérgio Kukina, Gurgel de Faria e Paulo Sérgio Domingues votaram com a Sra. Ministra Relatora.Presidiu o julgamento o Sr. Ministro Paulo Sérgio Domingues."
2395616,AIEDARESP,Ministro HERMAN BENJAMIN (1132),T2 - SEGUNDA TURMA,11/03/2024,DJe 06/05/2024,"PROCESSUAL CIVIL. PRECATÓRIO COMPLEMENTAR. CORREÇÃO MONETÁRIA. TEMA 905/STJ.1. A hipótese dos autos trata de precatório complementar para cobrança de correção monetária, no qual o Tribunal entendeu ser aplicável o precedente proferido nos autos da ADI 4425, em que o Supremo Tribunal Federal reconheceu a validade de todos os precatórios expedidos até 25-3-2015 e atualizados pela TR.2. O STF, ao julgar a ADI 4.357/DF e a ADI 4.425/DF, assim como o RE 870.947/SE, em regime de repercussão geral, considerou constitucional a incidência de juros de mora com base no índice oficial de remuneração da caderneta de poupança, nas condenações impostas à Fazenda Pública, excetuados os débitos de natureza tributária.3. Nesse contexto, afastou a aplicação do art. 1º-F da Lei 9.497/1997,com a redação dada pela Lei 11.960/2009, para fins de correção monetária sobre débito de qualquer natureza, mantida sua incidência no que concerne à fixação dos juros de mora, salvo em relação a débitos oriundos de relação jurídico-tributária.4. O STJ possui o entendimento no mesmo sentido, fixado no Tema 905, submetido à sistemática dos Recursos Especiais repetitivos, em que afirma que ""a modulação dos efeitos da decisão que declarou inconstitucional a atualização monetária dos débitos da Fazenda Pública com base no índice oficial de remuneração da caderneta de poupança, no âmbito do Supremo Tribunal Federal, objetivou reconhecer a validade dos precatórios expedidos ou pagos até 25 de março de 2015, impedindo, desse modo, a rediscussão do débito baseada na aplicação de índices diversos. Assim, mostra-se descabida a modulação em relação aos casos em que não ocorreu expedição ou pagamento de precatório."" (REsp 1.495.146/MG, Rel. Min. Mauro Campbell Marques, Primeira Seção, DJe 2/3/2018).5. O acórdão recorrido está em sintonia com o atual entendimento do STJ. Incide, in casu, o princípio estabelecido na Súmula 83/STJ.6. Agravo Interno não provido.",https://processo.stj.jus.br/SCON/GetInteiroTeorDoAcordao?num_registro=201402368261&dt_publicacao=06/05/2024,"PROCESSUAL CIVIL. PRECATÓRIO COMPLEMENTAR. CORREÇÃO MONETÁRIA. TEMA 905/STJ.1. A hipótese dos autos trata de precatório complementar para cobrança de correção monetária, no qual o Tribunal entendeu ser aplicável o precedente proferido nos autos da ADI 4425, em que o Supremo Tribunal Federal reconheceu a validade de todos os precatórios expedidos até 25-3-2015 e atualizados pela TR.2. O STF, ao julgar a ADI 4.357/DF e a ADI 4.425/DF, assim como o RE 870.947/SE, em regime de repercussão geral, considerou constitucional a incidência de juros de mora com base no índice oficial de remuneração da caderneta de poupança, nas condenações impostas à Fazenda Pública, excetuados os débitos de natureza tributária.3. Nesse contexto, afastou a aplicação do art. 1º-F da Lei 9.497/1997,com a redação dada pela Lei 11.960/2009, para fins de correção monetária sobre débito de qualquer natureza, mantida sua incidência no que concerne à fixação dos juros de mora, salvo em relação a débitos oriundos de relação jurídico-tributária.4. O STJ possui o entendimento no mesmo sentido, fixado no Tema 905, submetido à sistemática dos Recursos Especiais repetitivos, em que afirma que ""a modulação dos efeitos da decisão que declarou inconstitucional a atualização monetária dos débitos da Fazenda Pública com base no índice oficial de remuneração da caderneta de poupança, no âmbito do Supremo Tribunal Federal, objetivou reconhecer a validade dos precatórios expedidos ou pagos até 25 de março de 2015, impedindo, desse modo, a rediscussão do débito baseada na aplicação de índices diversos. Assim, mostra-se descabida a modulação em relação aos casos em que não ocorreu expedição ou pagamento de precatório."" (REsp 1.495.146/MG, Rel. Min. Mauro Campbell Marques, Primeira Seção, DJe 2/3/2018).5. O acórdão recorrido está em sintonia com o atual entendimento do STJ. Incide, in casu, o princípio estabelecido na Súmula 83/STJ.6. Agravo Interno não provido.","Vistos e relatados estes autos em que são partes as acima indicadas, acordam os Ministros da SEGUNDA TURMA do Superior Tribunal de Justiça, em sessão virtual de 05/03/2024 a 11/03/2024, por unanimidade, negar provimento ao recurso, nos termos do voto do Sr. Ministro Relator.Os Srs. Ministros Francisco Falcão, Mauro Campbell Marques e Afrânio Vilela votaram com o Sr. Ministro Relator.Presidiu o julgamento o Sr. Ministro Afrânio Vilela."
2430361,AINTARESP,Ministro HERMAN BENJAMIN (1132),T2 - SEGUNDA TURMA,29/04/2024,DJe 03/05/2024,"PREVIDENCIÁRIO E PROCESSUAL CIVIL. AGRAVO INTERNO NO AGRAVO EMRECURSO ESPECIAL. TEMAS 810 E 96 DE REPERCUSSÃO GERAL. JUROS DE MORA E CORREÇÃO MONETÁRIA. INPC. HONORÁRIOS DE SUCUMBÊNCIA. APLICAÇÃO EM COMSONÂNCIA COM CPC/1973. SÚMULA 7/STJ. DISSÍDIO JURISPRUDENCIAL. ANÁLISE. PREJUÍZO.1. Na sessão do dia 3.10.2019, o Plenário do STF concluiu o julgamento do RE 870.947/SE, submetido ao Rito da Repercussão Geral (Tema 810/STF), e rejeitou por maioria todos os Embargos de Declaração opostos, sem modular os efeitos da decisão anteriormente proferida no leading case.2. Em observância à orientação da Corte Suprema, a Primeira Seção deste Tribunal Superior julgou os Recursos Especiais 1.495.146/MG, 1.492.221/PR e 1.495.144/RS (Rel. Ministro Mauro Campbell Marques), vinculados ao Tema 905/STJ, e determinou que as condenações de natureza previdenciária impostas à Fazenda Pública sujeitam-se à incidência do INPC, para fins de correção monetária, no que se refere ao período posterior à vigência da Lei 11.430/2006, que incluiu o art. 41-A na Lei 8.213/1991. Os juros de mora incidem segundo a remuneração oficial da caderneta de poupança (art. 1º-F da Lei 9.494/1997, com redação dada pela Lei 11.960/2009).3. A Primeira Seção do STJ, ainda no julgamento do supracitado Tema, firmou a compreensão de que, em se tratando de causas previdenciárias, as condenações impostas à Fazenda Pública, para efeito de correção monetária, sujeitam-se à incidência do INPC a partir da vigência do art. 41-A da Lei n. 8.213/1991, com a redação incluída pela Lei n. 11.430/2006.4. No caso concreto, a sentença que fixou a verba honorária foi publicada na vigência do CPC de 1973. Desse modo, o regime aplicável ao caso é aquele previsto no art. 20 e parágrafos do CPC/1973, e não o no art. 85 do CPC/2015, que teve sua vigência iniciada apenas em 18.3.2016. A parte recorrente, por seu lado, insurge -se contra o montante fixado a título de honorários advocatícios pelas instâncias de origem.5. É assente no STJ que a modificação do valor da verba honorária fixado pelas instâncias de origem esbarra no óbice da Súmula 7/STJ (""A pretensão de simples reexame de prova não enseja Recurso Especial""), o qual somente é relativizado em situações excepcionais, que se configuram quando os honorários são estabelecidos em montantes irrisórios ou exorbitantes, que não é o caso dos autos.4. Fica prejudicada a análise da divergência jurisprudencial quando a tese sustentada já foi afastada na apreciação do Recurso Especial pela alínea ""a"" do permissivo constitucional.5. Agravo Interno não provido.",https://processo.stj.jus.br/SCON/GetInteiroTeorDoAcordao?num_registro=202302831125&dt_publicacao=03/05/2024,"PREVIDENCIÁRIO E PROCESSUAL CIVIL. AGRAVO INTERNO NO AGRAVO EMRECURSO ESPECIAL. TEMAS 810 E 96 DE REPERCUSSÃO GERAL. JUROS DE MORA E CORREÇÃO MONETÁRIA. INPC. HONORÁRIOS DE SUCUMBÊNCIA. APLICAÇÃO EM COMSONÂNCIA COM CPC/1973. SÚMULA 7/STJ. DISSÍDIO JURISPRUDENCIAL. ANÁLISE. PREJUÍZO.1. Na sessão do dia 3.10.2019, o Plenário do STF concluiu o julgamento do RE 870.947/SE, submetido ao Rito da Repercussão Geral (Tema 810/STF), e rejeitou por maioria todos os Embargos de Declaração opostos, sem modular os efeitos da decisão anteriormente proferida no leading case.2. Em observância à orientação da Corte Suprema, a Primeira Seção deste Tribunal Superior julgou os Recursos Especiais 1.495.146/MG, 1.492.221/PR e 1.495.144/RS (Rel. Ministro Mauro Campbell Marques), vinculados ao Tema 905/STJ, e determinou que as condenações de natureza previdenciária impostas à Fazenda Pública sujeitam-se à incidência do INPC, para fins de correção monetária, no que se refere ao período posterior à vigência da Lei 11.430/2006, que incluiu o art. 41-A na Lei 8.213/1991. Os juros de mora incidem segundo a remuneração oficial da caderneta de poupança (art. 1º-F da Lei 9.494/1997, com redação dada pela Lei 11.960/2009).3. A Primeira Seção do STJ, ainda no julgamento do supracitado Tema, firmou a compreensão de que, em se tratando de causas previdenciárias, as condenações impostas à Fazenda Pública, para efeito de correção monetária, sujeitam-se à incidência do INPC a partir da vigência do art. 41-A da Lei n. 8.213/1991, com a redação incluída pela Lei n. 11.430/2006.4. No caso concreto, a sentença que fixou a verba honorária foi publicada na vigência do CPC de 1973. Desse modo, o regime aplicável ao caso é aquele previsto no art. 20 e parágrafos do CPC/1973, e não o no art. 85 do CPC/2015, que teve sua vigência iniciada apenas em 18.3.2016. A parte recorrente, por seu lado, insurge -se contra o montante fixado a título de honorários advocatícios pelas instâncias de origem.5. É assente no STJ que a modificação do valor da verba honorária fixado pelas instâncias de origem esbarra no óbice da Súmula 7/STJ (""A pretensão de simples reexame de prova não enseja Recurso Especial""), o qual somente é relativizado em situações excepcionais, que se configuram quando os honorários são estabelecidos em montantes irrisórios ou exorbitantes, que não é o caso dos autos.4. Fica prejudicada a análise da divergência jurisprudencial quando a tese sustentada já foi afastada na apreciação do Recurso Especial pela alínea ""a"" do permissivo constitucional.5. Agravo Interno não provido.","Vistos e relatados estes autos em que são partes as acima indicadas, acordam os Ministros da SEGUNDA TURMA do Superior Tribunal de Justiça, em sessão virtual de 23/04/2024 a 29/04/2024, por unanimidade, negar provimento ao recurso, nos termos do voto do Sr. Ministro Relator.Os Srs. Ministros Francisco Falcão, Mauro Campbell Marques, Teodoro Silva Santos e Afrânio Vilela votaram com o Sr. Ministro Relator.Presidiu o julgamento o Sr. Ministro Afrânio Vilela."
